L2_orth,L2_ipa,L2_gloss,L2_etym
lanaw,,"land exploration, Synonyms: galugad, eksplorasyon",
lanaw,,"land exploration, Synonyms: galugad, eksplorasyon",
lanay,,"spread out (as of spilt oil or ink), Synonym: kalat",
lanay,,"spread of liquid (as of spilt oil or ink), soft tar",
lanay,,lanai (Hawaiian-style roofed patio),
lanay,,lanai (Hawaiian-style roofed patio),
landa,/lanˈda/,axe handle,
landas,/lanˈdas/,"path; trail; pathway; footpath
Synonyms: daan, daanan, bagnos, damlas",
landas,/lanˈdas/,"(dialectal, Batangas) slipperiness
Synonyms: kadulasan, dulas, pagkamadulas",
landi,/lanˈdiʔ/,coquette; flirt,
landi,/lanˈdiʔ/,"flirtatious; coquettish; sensuous
Synonyms: kiri, lantod, talandi, hitad",
Landicho,,"A  surname, from Basque",
landit,/lanˈdit/,"prurient; lascivious; lustful
Synonym: landi",
Landrito,,A  surname​.,
langal,/laˈŋal/,"sunken (of one's eyes)
Synonyms: lubog, urong",
langaray,/laˈŋaɾai/,glassfish (Ambassidae),
langasngas,/laŋasˈŋas/,"sound of gnashing teeth (as when chewing sugarcane, sand, or something brittle)",
langaw,/ˈlaŋau/,fly (insect),
langayak,/laŋaˈjak/,"idle; indolent; lazy
Synonyms: batugan, tamad",
langgam,/laŋˈɡam/,"ant, Synonym: (dialectal, Batangas, Marinduque) guyam",
langhapan,/laŋˈhapan/,inhaler; inhaling apparatus,
langib,/laˈŋib/,"scab (of a wound), slough (of a wound)",
langil,/ˈlaŋil/,"acacia
Synonym: akasya",
langis,/laˈŋis/,"oil, Synonym: aseyte, (colloquial) servile flattery,",
langit,/ˈlaŋit/,"sky (atmosphere above a point), heaven, (figuratively)",
langka,/laŋˈkaʔ/,jackfruit,
langkaan,/laŋˈkaʔan/,"jackfruit plantation, place with plenty of jackfruit",
Langkaan,,"A former  barangay of Dasmariñas, Philippines; now",
langkal,/laŋˈkal/,"spongy (of texture)
Synonym: esponghado",
langkas,/laŋˈkas/,"half-witted
Synonyms: bobo, uto-uto, kulang ng isang tornilyo sa ulo",
langkaw,/laŋˈkau/,elongated and thin (of legs or neck),
langkay,/laŋˈkai/,"cluster or bunch of fruits
Synonyms: buwig, kumpol, piling",
langkayan,/laŋˈkajan/,"stretcher; litter, Synonym: kamilya, bier with shafts,",
langkayan,/laŋˈkajan/,"in bunches or clusters, Synonyms: buwig-buwig, kumpol-kumpol,",
langoy,/laˈŋoi/,"swimming, Synonym: paglangoy",
langoy,/laˈŋoi/,(colloquial) swimmable within a certain distance (of,
langyot,/laŋˈjot/,caressing expression in a baby-talk manner accompanied by fondling (usually from child to parent),
lanip,/ˈlanip/,spread or expansion of skin ulcer,
lanip,/ˈlanip/,spread or scattered all over a certain place,
lanlan,/lanˈlan/,singing without the proper lyrics (especially with,
lanog,/ˈlanoɡ/,"gruff, rough, thick voice
Synonyms: lagong, baho, baso",
lansangan,/lanˈsaŋan/,"road; street, Synonyms: kalye, kalsada, daan",
Lansangan,,A  surname​.,
lansones,/lanˈsones/,langsat; lanzon (Lansium parasiticum),
lanta,/lanˈta/,"withered; faded (of leaves, flowers, vegetables, etc.)
mga lantang gulaywithered vegetables",
lanta,/lanˈta/,"condition of being withered (of leaves, flowers, vegetables, etc.)",
lantaka,/lanˈtakaʔ/,"small, brass cannon",
lantana,/lanˈtanaʔ/,common lantana (Lantana camara),
lantay,/lanˈtai/,"unalloyed; pure (especially of gold)
Synonyms: puro, dalisay",
Lantican,,A  surname​.,
lanting,/lanˈtiŋ/,broadleaf plantain (Plantago major),
Lanting,,A  surname​. of native origin.,
lantod,/lanˈtod/,"flirtatious; coquettish; lascivious; indecently dressed (usually said of women)
Synonyms: hitad, kiri, landi, talandi",
lantod,/lanˈtod/,flirt; coquette,
lantong,/lanˈtoŋ/,"stench of rotten meat or fish
Synonyms: angot, baho",
lantot,/lamˈbiŋ/,"stench of stagnant water (especially with decaying leaves)
Synonyms: antot, bantot",
lantutay,/lanˈtutai/,"idler; loiterer
Synonyms: lakuwatsero, bulakbulero, bagamundo, hampaslupa, aligando",
lantutay,/lanˈtutai/,"lazy; slothful; indolent
Synonyms: tamad, batugan, matigas ang katawan",
lanubo,/laˈnuboʔ/,"long, young, fresh tree branch with its twig and leaves",
lanunab,/laˈnunab/,"toy boat
Synonym: bangka-bangkaan",
Lanuza,/laˈnusa/,"A  surname, from Spanish​.",
Lao,/lau/,"A  surname, from Min Nan of Chinese origin.",
laog,/ˈlaoɡ/,undomesticated; wild (especially of cats),
Laos,/ˈlaʔos/,Laos (a country in Asia),
laos,/laˈʔos/,"outdated; old-fashioned; antiquated; obsolete
Synonyms: paso, lipas",
laot,/ˈlaʔot/,"deep sea; midsea; high seas, Synonym: karagatan, (figuratively)",
lapad,/ˈlapad/,"wideness, Synonyms: kalaparan, kaluwangan, extensiveness,",
lapad,/ˈlapad/,"flatness; broadness (of an object), Synonym: pagkalapad,",
lapad,/ˈlapad/,flat and broad (of an object),
lapas,/laˈpas/,"fish from the genus Caesio, Synonym: dalagambukid",
lapas,/laˈpas/,(Batangas) settlement of accounts or disagreements,
lapas,/laˈpas/,(Batangas) settlement of accounts or disagreements,
lapay,/laˈpai/,(anatomy) pancreas,
lapay,/laˈpai/,lacking in claimed weight (as checked in the balance),
lapay,/laˈpai/,small house or shelter (built in the middle of a high lot or on top of a hill),
Lapeña,,"A  surname, from Spanish​.",
lapi,/ˈlapiʔ/,"(grammar) affix
Synonym: panlapi",
lapida,/ˌlapiˈda/,"tombstone; gravestone (with inscription), stone tablet;",
lapig,/ˈlapiɡ/,(nautical) a type of sea vessel (similar to a biray),
laping,/laˈpiŋ/,"dewlap (as of a cattle)
Synonym: lambi",
lapis,/ˈlapis/,"pencil, graphite; black lead, Synonym: grapito, doublespotted",
lapisa,/lapiˈsaʔ/,"kneaded (of dough)
Synonym: lamas",
lapnis,/lapˈnis/,"torn; stripped off (of tree bark or skin)
Synonyms: talop, tuklap, paknit, gitgit",
lapnis,/lapˈnis/,"stripping of bark (from a tree)
Synonyms: tuklap, pagtuklap, paknit, pagpaknit",
lapnos,/lapˈnos/,"flayed; excoriated (of burnt or scalded skin)
Synonyms: talop, bakbak",
lapnos,/lapˈnos/,flayed skin; excoriated skin (due to being burnt or scalded),
lapot,/ˈlapot/,"viscosity; viscidity; thickness of liquid
Antonyms: labnaw, kalabnawan",
lapurit,/lapuˈɾit/,"crumpled; rumpled (by wetting or manhandling with one's fingers, of cloth or leather)
Synonyms: lapirot, lamukot, lamukos, gusot",
lapurit,/lapuˈɾit/,"crushing; rumpling (by wetting or manhandling with one's fingers, of cloth or leather)",
lapya,/lapˈjaʔ/,flattened (thin and wide),
lapya,/lapˈjaʔ/,(geometry) plane,
lapyad,/lapˈjad/,flat nose,
lapyad,/lapˈjad/,flat-nosed; platyrrhine,
Laqui,,A  surname​.,
Laquindanum,,"A  surname, from Ilocano​.",
larawan,/laˈɾawan/,"picture; portrait; photograph, Synonyms: retrato, imahen,",
laray,/ˈlaɾai/,highness of the pitch of voice,
laris,/laˈɾis/,"obstinacy; stubbornness
Synonyms: tigas ng ulo, katerkuhan, tigas ng loob, kasutilan",
laro,/laˈɾoʔ/,game; play,
laro,/laˈɾoʔ/,dregs of oil,
larot,/laˈɾot/,"made out of shape, crumpled, frayed, or dented (due to too much handling or misuse)",
Larrazabal,,"A  surname, from Basque​.",
laruan,/laɾuˈʔan/,"toy, Synonyms: (Batangas) galawan, (obsolete) ayamin,",
laruan,/laɾuˈʔan/,"playground, Synonym: palaruan, game court (for basketball,",
laryo,/laɾˈjo/,"brick (hardened block used for building), Synonym:",
lasa,,"taste; flavor; savor, Synonyms: namnam, linamnam, lasap,",
lasa,,"tiger grass, silvering compound used to manufacture",
lasa,,"destroyed (with parts detached or forced off), Synonyms:",
lasa,,"tiger grass, silvering compound used to manufacture",
lasa,,"destroyed (with parts detached or forced off), Synonyms:",
lasa,,"destroyed (with parts detached or forced off), Synonyms:",
Lasam,,A municipality of Cagayan.,
Lasam,,A  surname​.,
lasap,/laˈsap/,"fine taste; enjoyable taste
Synonyms: linamnam, sarap",
Lascano,,"A  surname, from Basque​.",
lasenggero,/laseŋˈɡeɾo/,Alternative form of lasinggero,
lasenggo,/laˈseŋɡo/,"(informal, derogatory) drunkard; alcoholic, Synonyms:",
lasenggo,/laˈseŋɡo/,always drunk,
lasgas,,heartwood; hard core of timber,
lasing,/laˈsiŋ/,"drunk; inebriated
Synonyms: lango, barik",
lasing,/laˈsiŋ/,"drunkenness
Synonyms: kalasingan, lango, kalanguhan",
laskuta,/lasˈkutaʔ/,"(nautical) sheet (of a sail)
Synonym: sampapang layag",
laso,,"ribbon, Synonym: sintas, bow; bowknot (made of ribbon),",
laso,,"oral or labial inflammation (especially among children),",
laso,,"excessive; profuse; exaggerated, Synonyms: labis-labis,",
laso,,burn on the tongue,
laso,,"oral or labial inflammation (especially among children),",
laso,,"excessive; profuse; exaggerated, Synonyms: labis-labis,",
laso,,burn on the tongue,
laso,,burn on the tongue,
lasog,/laˈsoɡ/,"broken into pieces; torn or pulled apart (especially of bones)
Synonyms: durog, durog-durog",
lasog,/laˈsoɡ/,"breaking into pieces (especially of bones)
Synonyms: durog, pagdurog, pagkadurog",
lason,/ˈlason/,"poison, venom, Synonyms: kamandag, beneno, (figuratively)",
laspag,/lasˈpaɡ/,"raped; violated, Synonyms: nilaspag, ginahis, ginapang,",
lastag,/lasˈtaɡ/,"nude
Synonyms: lasog, hubad, hubo't hubad",
lastay,/lasˈtai/,"bamboo sieve used in the process of smoking fish, cable",
lastiko,/ˌlastiˈko/,"rubber band; elastic band, Synonym: goma, children's",
Lastimosa,,"A  surname, from Spanish​.",
lasunin,/laˈsunin/,to poison,
laswa,/lasˈwaʔ/,"lewd, indecent, or erotic expression; ribald language
Synonyms: kabastusan, kalaswaan, kababuyan",
lata,,"can; tin can, tin (metal), can of kerosene, Synonym:",
lata,,made of tin,
lata,,"softness; tenderness (of meat, etc.), Synonyms: lambot,",
lata,,"softness; tenderness (of meat, etc.), Synonyms: lambot,",
latak,/ˈlatak/,"residue; dregs; lees; sediment
Synonym: tining",
latak,/ˈlatak/,"angle of drop, dip, or descent (viewed from the top)
Synonym: tarik",
latay,/ˈlatai/,welt; wale; weal; wheal,
Lataya,,A  surname​.,
Latayan,,"A  surname, from Hiligaynon​.",
lathala,/latˈhalaʔ/,"publication; publishing
Synonyms: paglalathala, pagkakalathala",
lathala,/latˈhalaʔ/,"published (in a newspaper, etc.)",
lati,/ˈlatiʔ/,"swamp; bog; marsh
Synonyms: lusak, putikan, balaho",
latigo,/ˌlatiˈɡo/,"whip; lash, Synonyms: asote, kumpas, act of whipping",
latok,,"provisional, low table for kitchen use (crudely made",
latok,,"decayed; rotten (of wood), Synonyms: gapok, gato",
latok,,condition of being decayed or rotten,
latok,,Telosma procumbens (woody vine with slender branches),
latok,,Telosma procumbens (woody vine with slender branches),
Laude,,A  surname​.,
Lautinco,,A  surname​.,
Laviña,,"A  surname, from Spanish​.",
lawa,/ˈlawaʔ/,"lake; lagoon, Synonyms: dagat-dagatan, pulilan, laguna,",
lawa,/ˈlawaʔ/,"flooded; covered with water, Synonym: sanaw",
lawaan,/laˈwaʔan/,"member of the Shorea species of rainforest trees, Synonym:",
Lawag,,A  surname​.,
lawak,/ˈlawak/,"extent; expanse; reach
Synonyms: laki, luwang, lapad, saklaw",
laway,/ˈlawai/,"saliva; spittle, Synonym: dura, slimy substance of",
laway,/ˈlawai/,"having excessive flow of saliva (of a person), Synonyms:",
lawi,/laˈwi/,long tail feather of a rooster,
lawin,/ˈlawin/,"hawk, flying fish",
lawing,/laˈwiŋ/,"tatters; rags hanging down
Synonyms: tawing, lamuymoy",
lawing,/laˈwiŋ/,"hanging loosely
Synonyms: tawing, nakatawing",
lawlaw,/lauˈlau/,dangling; sagging; hanging down; hanging loose,
lawlaw,/lauˈlau/,(archaic) sardine,
Laxamana,,"A  surname, from Sanskrit of Sanskrit origin, a spelling",
laya,,Freedom.,
laya,,"The state of being free (of restraints, such as external factors or grief).
Unti-unting lumalaya si Bb. Encarnacion sa bigat ng pagyaon ng kanyang lola.Ms. Encarnacion is slowly shaking free from the weight of her grandmother's passing.",
laya,,"Having the ability to move in an unconstrained manner; being unconstrained.
Malayang nagtakbuhan sina Inggo sa pagpa-Patintero nila.Inggo and the others freely ran about as they played Patintero.",
layag,/ˈlajaɡ/,sail,
layak,,"flotsam; rubbish left by receding waters, Synonyms:",
layang-layang,/lajaŋˈlajaŋ/,swift (bird),
layas,/laˈjas/,get out!; go away!; begone!,
layas,/laˈjas/,desertion; act of fleeing,
layas,/laˈjas/,"vagabond, runaway",
layaw,/ˈlajɐw/,freedom from parental control,
layaw,/ˈlajɐw/,"pampered, spoiled",
Laygo,/ˈlaiɡo/,A  surname​.,
laylay,,state or condition of being drooped or hanging loosely,
laylay,,drooping; hanging loosely or weakly,
laylayan,/laiˈlajan/,"edge or fringe of a piece of clothing, hemline, (by",
Laylo,,A  surname​.,
layon,,purpose; aim; objective; intention,
layon,,"wide, deep part of a river",
layter,,"lighter, year unknown, Kaputol Mundo - Pagkaintindi",lighter
Lazarte,,"A  surname, from Basque​.",
LDP,,Initialism of Laban ng Demokratikong Pilipino.,
Ledesma,,"A  surname, from Spanish​, most notably borne by:,",
leeg,/leˈʔeɡ/,"(anatomy) neck, part of a garment that covers or encircles",
Legazpi,/leˈɡaspi/,"Legazpi (a city, the capital city of Albay, Philippines)",
legwas,/ˈleɡwas/,"league (unit of measurement), 1838, Francisco Balagtas,",
lehitimo,/leˈhitimo/,"legitimate, Synonyms: taal, katutubo, genuine; real,",
Lemery,,"A municipality of Batangas, Philippines., A municipality",
lengguwahe,/leŋɡuˈahe/,"language; idiom; speech, Synonyms: wika, salita, idyoma",
Leong,/ljoŋ/,"A  surname, from Cantonese of Cantonese Chinese origin",
Lerma,,A female given name,
lesbyana,/lesˈbjana/,Alternative form of lesbiyana,
lespu,/ˈlespu/,"(slang, back slang) police, Synonyms: pulis, pulisya,",pulis
Letlet,,"A diminutive of the female given name Leticia., 2000,",
letmaku,/ˌletmaˈku/,"(slang, back slang) stubbornly repetitious; insistent,",
letra,/ˈletɾa/,"letter (of the alphabet), Synonym: titik, penmanship;",
letse,/ˈlet͡ʃe/,"(vulgar, derogatory) exclamation of displeasure, disgust,",
letse,/ˈlet͡ʃe/,"(vulgar, derogatory) generic intensifier: damn; bloody;",
letse,/ˈlet͡ʃe/,"(vulgar, derogatory) jerk; bastard, Synonym: gago,",
letsugas,/leˈt͡ʃuɡas/,lettuce,
Leung,/ljuŋ/,"A  surname, from Cantonese of Chinese origin.",
Leviste,,"A  surname​, most notably borne by:
Mark Leviste, Filipino politician",
Lew,/lʊ/,"A  surname, from Min Nan of Chinese origin.",
Leynes,,A  surname​.,
libag,,thick dirt on the skin,
libak,/liˈbak/,"mockery; derision; ridicule; insult, Synonyms: aglahi,",
libang,,"To occupy oneself, to keep busy.",
Libano,,Lebanon,
libay,,female deer; doe,
libid,,"single coil or turn around something (of a wire, rope, etc.)",
libing,-iŋ,burial; interment; funeral,
libingan,,"grave; tomb, cemetery",
libis,,hillside; slope of a hill or mountain,
libo,,thousand,
libog,,"libido, sexual urges or drives",
libra,,pound (unit of mass or force/weight),
Librada,,A female given name. Male: Librado,
Libradilla,,A  surname​.,
libre,/ˈlibɾe/,free; without charge; gratis,
libro,/li.ˈbro/,"book, Synonym: aklat",
libtos,,(medicine) blister,
libtos,,with or having blisters,
libumbon,,crowd,
Libunao,,"A  surname, from Cebuano​.",
libuntaon,/li.bun.ta.ˈʔɔn/,millennium,
Libya,,Libya,Libya
Lichauco,,"A Filipino-Chinese surname, from Min Nan",
ligat,,"delicious consistency (esp. of cooked rice, tubers, etc.)",
ligawgaw,,ticklish feeling (on parts of the body other than the armpits),
Ligaya,,A female given name.,
ligis,,ground; milled; crushed,
ligpit,/liɡˈpit/,to clear; to get rid of; to dispose,
ligpitin,,"to clear; to put away, Ligpitin mo ang iyong mga laruan.Please",
ligtas,,safe; free from danger,
ligwan,,A smaller species of honeybee,
liha,/ˈliha/,sandpaper,
liham,/ˈli.ham/,"letter, written message",
lihi,/liˈhi/,An instance of food craving during pregnancy.,
lihim,/ˈlihim/,"secret, Synonym: sekreto",
lihim,/ˈlihim/,"secret, Synonym: sekreto",
lihiya,,(chemistry) lye; lixivium,
liho,,deceit; trickery,
lihukan,/ˈli.hu.kan/,kinematics,
liig,,Alternative form of leeg,
liing,,sidelong glance or look,
liit,,smallness,
likas,/ˈli.kas/,natural,
likas,/ˈli.kas/,"exodus, evacuation",
likat,,interruption; intermission,
likaw,,loop; coil; roll; hank,
likha,/likˈha/,a statue of an ancient spirit or god; idol,
likha,/likˈha/,"act of making, or producing something, Synonyms: gawa,",
likha,/likˈha/,"made, produced (by), Synonyms: gawa, ginawa, yari,",
likha,/likˈha/,"act of making, or producing something, Synonyms: gawa,",
likha,/likˈha/,"made, produced (by), Synonyms: gawa, ginawa, yari,",
likido,,liquid,
likido,,"(chemistry) liquid, 1935,  Marcial G. Mendiola,  Kabuhayan",
liknayan,/lik.ˈna.jan/,(neologism) physics,
lila,/lɪːˈlɐ/,(color) purple; violet,
Lilia,,"A female given name from Spanish, equivalent to English",
lilip,,hem,
lilok,/ˈlilok/,"act of carving wood or stone into figures as statues, ornaments, etc.",
lilok,/ˈlilok/,carved; sculpted,
lilom,/ˈli.lom/,shade; shady place,
Lim,/lim/,"A  surname, from Min Nan of Chinese origin.",
lima,/liˈma/,"five, Synonym: singko",
limahi,/li.maˈhiʔ/,slovenly; untidy,
limahid,/liˈmahid/,bruise (on the body),
limampu,/li.mam.ˈpuʔ/,fifty,
limandaan,/li.ˈman.da.ˈan/,five hundred,
limanlaksa,/li.ˈman.lak.ˈsaʔ/,fifty thousand,
limay,/ˈli.maj/,water left on foreshore by low tide,
Limbaga,,A  surname​.,
limbay,,gliding by the air by birds,
Limcaoco,,"A  surname, from Min Nan​.",
limit,/ˈli.mit/,frequency,
limitasyon,,limitation,
Limjoco,/limˈd͡ʒoko/,"A  surname, from Min Nan of Hokkien origin",
limon,,lemon,
limos,/liˈmos/,alms,
limpa,,(anatomy) spleen,
limpal,,very big piece; huge piece of something,
limpik,,very large jar with handles (in some areas),
Lina,,A  surname​.,
linab,,greasy or fatty scum on the surface of liquids,
Linao,,A  surname​.,
Linatoc,,A  surname​.,
linatsay,,mackerel fry,
linay,,"careful study or analysis of evidence, or arguments such as presented in a court of law",
linay,,well-studied or analyzed,
lindayag,,recovery of peace of mind after a fright of surprise,
lindol,/linˈdol/,earthquake,
linga,,sesame,
linga,,act or manner of looking around as if searching for someone,
Lingad,,A  surname​.,
lingaw,,bewildered; confused,
lingaw,,shouting; clamor,
lingawngaw,,unintelligible murmuring of a crowd of people; hum or echo of many voices,
linggal,,din; clamor; loud noise,
linggatong,,mental perturbation or worry,
linggaw,,turmoil; clangor,
linggi,,"(carpentry) narrow, deep and long mortise on wood",
linggit,,littleness; smallness; tininess,
Linggo,/liŋˈɡo/,"Sunday, Synonyms: (archaic) Dominggo, Dinggo",
linggo,/liŋˈɡo/,week,
lingguwistika,/ʔakˈdaʔ/,"linguistics, Synonyms: dalubwikaan, aghamwika, agwika,",
linggwistika,,"Superseded, pre-2007 spelling of lingguwistika.",
lingid,,secret; hidden; unknown; concealed,
lingil,,attending to some task,
lingil,,attention to some task,
lingindayat,,a species of grass,
lingkaw,,scythe,
lingkod,,servant,
lingming,,stupefied; bewildered,
lingo,,assassination; treacherous killing or murder,
lingon,/liˈŋon/,act of turning one's face,
linib,,"small, narrow window (usually for ventilation)",
linis,/ˈlinis/,cleanliness,
linisan,,"clean the surface of something, Nilinisan ko ang kotse.I",
linisin,,(transitive) clean,
linlang,,to deceive,
linse,,lynx,
linsil,,erroneous; improper; morally wrong,
linta,/linˈtaʔ/,"leech, bloodsucker, (figuratively) usurer",
lintang-kati,,slug,
lintik,,"(derogatory, vulgar, offensive) cursed; damned, (vulgar,",
lintik,,"(vulgar) Used to express anger, contempt, frustration",
lintik,,"lightning, (derogatory, vulgar, offensive) General",
linuknok,,fine physique,
lipa,,a species of nettle-like plant with hairs that sting and cause very painful blisters,
lipa,,(uncommon) trip; stumble,
lipad,,"flight; act or manner of flying, trip by air (as in",
lipak,,"callus; corn
Synonym: kalyo",
lipana,,widespread; diffused; found everywhere,
lipat,,transfer,
lipi,,ancestry; family; lineage,
lipit,,rim of basket tightly wound in rattan or reed,
lipon,/ˈli.pon/,crowd; gathering,
lipot,,first or advanced distant sight of one arriving,
lipstik,,lipstick,lipstick
lipumpon,,gathering of people,
lipunan,/li.ˈpu.nan/,"society, group gathered together for conversation",
lipya,,plowshare,
Liquigan,,A  surname​.,
lira,,lyre,
lira,,lira (former currency of Italy),
lira,,swollen and reddened eyelids,
lira,,lira (former currency of Italy),
lira,,swollen and reddened eyelids,
lira,,swollen and reddened eyelids,
lirot,,diffused,
liryo,,lily,
lisa,,egg of a louse; nit,
lisensya,,"Superseded, pre-2007 spelling of lisensiya.",
Lising,,A  surname​.,
lislis,/lisˈlis/,"(of a dress or skirt) lifted up, raised up or blown",
liso,/ˈliso/,"simple; plain, Synonyms: payak, simple, yano",
lisok,,state or condition of being dislocated or sprained (as of bones),
lisok,,dislocated or sprained (as of bones),
listahan,,"list, 1987,  National Mid-week, Volume 2, Issues 15-28‎[1],",
litak,,fissure; small crack,
litang,,pried loose; dislodged (as of steps of stairs loosened or falling off),
litas,,"small split or cut; opening (such as a buttonhole on a piece of sewn material, dress, etc.)",
literasiya,/liteɾaˈsia/,literacy,literacy
literatura,,"literature, Synonym: panitikan",
litid,,tendon; ligament,
litik,,(anatomy) pulse beat,
litograpiya,,lithography,
litrato,/liˈtɾato/,"portrait, 2015, Marshall E Gass, Maririlag na mga Hagod",
litro,,(metrology) litre,
litson,,"the act of roasting a pig, roasted suckling piglet,",
Litstenstayn,,Liechtenstein,Liechtenstein
liturhiya,,liturgy,
Litwanya,,Lithuania,
lityo,,(chemistry) lithium,
Liwag,,A  surname​.,
Liwanag,,A  surname of native origin.,
liwat,,act of pouring liquid into another container,
Liwayway,,A female given name.,
liya,,pond scum,
Liyag,,A  surname​.,
liyamado,,"the winning bet or the favorite choice in bets, tournaments,",
liyamado,,"ranked in an advantageous position compared to others,",
Lizada,,A  surname​.,
Llamas,,"A  surname, from Spanish​.",
Llanera,,"A  surname, from Spanish​.",
Llanera,,A municipality of Nueva Ecija.,
Llanto,/ˈllanto/,A  surname​.,
Lo,,"A Filipino-Chinese surname, from Min Nan of Hokkien",
lobo,[ˈlobo],wolf,
lobo,[ˈlobo],balloon,
lobo,[ˈlobo],balloon,
Locsin,,"A  surname, from Min Nan of Chinese origin, most notably",
lodi,/ˈlodi/,(slang) used to refer to a person who does something,idol
Logarta,,A  surname​.,
lohika,,"logic, 1997, Rolando A. Suarez, Nasa tao ang gawa,",
lohikal,,logical,logical
Lojo,,A  surname​.,
loka,/ˈloka/,"female equivalent of loko, (colloquial, gay slang,",
loka,/ˈloka/,"female equivalent of loko, (informal, derogatory, offensive)",
loko,/ˈloko/,"(colloquial, offensive) insane; crazy, Synonyms: baliw,",
loko,/ˈloko/,"(derogatory, offensive) insane person, Synonyms: baliw,",
loko,/ˈloko/,the act of covering the face from the middle of the,
loko,/ˈloko/,"a pothole containing water, usually due to rain, a",
loko,/ˈloko/,the act of covering the face from the middle of the,
loko,/ˈloko/,"a pothole containing water, usually due to rain, a",
loko,/ˈloko/,"a pothole containing water, usually due to rain, a",
lola,,"grandmother, Masaya ang lola kahapon dahil dumating",
lola,,Obsolete spelling of lula (“dizzy”),
lola,,Obsolete spelling of lula (“diziness; seasickness;,
lola,,Obsolete spelling of lula (“dizzy”),
lola,,Obsolete spelling of lula (“diziness; seasickness;,
Loleng,,A diminutive of the female given name Dolores.,
lolo,,"grandfather, Masaya ang lola kahapon dahil dumating",
lomi,,Filipino noodle dish using egg noodles with a fine,
Lomibao,,A  surname​.,
Lomocso,,A  surname​.,
lona,/ˈlona/,canvas,
longganisa,/loŋɡaˈnisa/,pork sausage,
longhitud,/loŋˈhitud/,(geography) longitude,
Lontoc,,A  surname​.,
Loo,/lu/,"A  surname, from Min Nan of Chinese origin.",
loob,/lɔ.ˈʔɔb/,interior; inside; inner surface,
loobkaphay,/loʔobkapˈhai/,"(cytology, neologism) endoplasm",
loobpananagos,,endosmosis,
look,,A bay.,
Lopez,/ˈlopes/,"A  surname, from Spanish​., A municipality of Quezon,",
Lorico,,A  surname​.,
loryat,/ˈloɾjat/,lauriat (a special Chinese banquet with many courses,
loterya,/loˈteɾja/,lottery,
Lotlot,,A diminutive of the female given name Charlotte.,
Love,,A female given name from English,Love
Lovely,,A female given name from English,Lovely
lowat,,eyebags,
Lozada,/loˈsada/,"A  surname, from Spanish​, notably borne by:, Jun Lozada,",
Lualhati,,"A female given name., A  surname, from Tagalog​.",
Luansing,,A  surname​.,
lubak,/luˈbak/,hollow; depression; pothole (on a road),
lubak-lubak,/luˌbak luˈbak/,"potholed, Synonym: malubak",
lubang,,hilly country,
lubha,/lubˈhaʔ/,severity; seriousness,
lubha,/lubˈhaʔ/,"Used to form superlatives: extremely; very
Lubha kang masaya ngayon. ― You look very happy today.",
Lubiano,,"A  surname, from Basque​.",
lubid,,rope,
lubig,,home run (in a baseball game),
lublob,,to submerge,
lubo,,grouper,
lubo,,dimple (on the chin or cheek),
lubo,,deep hollow or depression in the ground,
lubo,,dimple (on the chin or cheek),
lubo,,deep hollow or depression in the ground,
lubo,,deep hollow or depression in the ground,
lubog,,sunken; sunk; immersed,
lubot,,(medicine) chapping of the hands,
lubyak,,rut made by wheels on a road,
Lucero,,"A  surname, from Spanish​.",
Lucy,/lusi/,A female given name from English,Lucy
luga,,smelly pus secretion in the ear,
lugami,/luˈɡa.mi(ʔ)/,a falling into misfortune or failure in life,
lugami,/luˈɡa.mi(ʔ)/,seated because of intense feelings or pain,
luganggang,,hollow; empty,
lugar,/luˈɡaɾ/,place,
lugaw,,rice porridge,
lugay,,hanging loose and not done up (as the long hair of a woman),
lugi,,(business) financial loss,
lugo,,extreme weakness due to sickness or frustration,
lugod,,delight; pleasure; satisfaction,
lugot,,wilted and falling (said of leaves and petals),
luha,,tear,
luho,/ˈluhoʔ/,luxury,
luhod,,act of kneeling,
luhuran,,"A surface, especially the railing in a pew, where one",
luhuran,,To kneel on something,
Luis,,A male given name from Spanish,
lukban,,pomelo,
lukbot,,pouch,
lukton,,young locust (still wingless),
lukutan,,A  species of wild bee that produces less sweet honey.,
lula,/luˈlaʔ/,dizzy,
lula,/luˈlaʔ/,"dizziness; nausea; queasiness
Synonyms: hilo, liyo",
lulay,,lullaby,
