ID,Form,IPA,Gloss,Language_ID
1187,mexcalli,[meʃˈka.lːi],Cooked maguey leaves.,0
1188,mexicatl,,Alternative spelling of mexihcatl,0
1189,Mexicatlahtolpan,,Alternative spelling of Mexihcatlahtolpan,0
1190,mexicopa,,Obsolete spelling of mēxihcopa,0
1191,mexicopauic,,Obsolete spelling of mēxihcopahuīc,0
1192,mexihcatl,[meːˈʃíʔkat͡ɬ],(he or she is) a Mexica.,0
1193,Mexihcatlahtolpan,/meːʃiʔkatɬaʔtoːlpan/,In the Mexican language; in the language of the Mexica,0
1194,mexihcayotl,,mexicanity.,0
1195,Mexihco,[meːˈʃíʔ.ko],Tenochtitlan; an altepetl and capital of the Aztec,0
1196,mexihcopa,[meː.ʃiʔˈko.pa],"To or toward Mexico-Tenochtitlan., 1571: Alonso de",0
1197,mexihcopahuic,[meː.ʃiʔ.koˈpa.wiːk],"To or toward Mexico-Tenochtitlan., 1571: Alonso de",0
1198,mexixin,[meˈʃíʃin̥],"(it is) an edible plant akin to the watercress.
1571: Alonso de Molina, Vocabulario en lengua castellana y mexicana y mexicana y castellana, pt 1, f. 55v. col. 2.
Mexixin. maſtuerço.
Mexixin. a watercress.
1571: Idem, Vocabulario en lengua castellana y mexicana y mexicana y castellana, pt 2, f. 82v. col. 1.
Maſtuerço yerua conocida. mexixin. mexixquilitl.
The watercress, a well-known herb. mexixin. mexixquilitl.",0
1199,mexixquilitl,[méʃiʃˈkílit͡ɬ],"(it is) an edible plant akin to the watercress., 1571:",0
1200,mexixquillaxcalli,[méʃiʃ.kílːaʃˈkálːi],(it is) a maize and watercress tortilla.,0
1201,meyollohtli,[me.joːˈlːóʔ.t͡ɬi],"(it is) the core of a young agave plant., 1555: Alonso",0
1202,meyollotli,,Obsolete spelling of meyōllohtli,0
1203,miahuatl,,corn tassel.,0
1204,miaoatvtvtl,,Obsolete spelling of miyahuatototl,0
1205,miauatl,,Obsolete spelling of miyahuatl,0
1206,miauatototl,,Obsolete spelling of miyāhuatōtōtl,0
1207,miccapetlacalli,[mik.kaː.pe.t͡ɬaːˈka.lːi],"grave, 1555: Alonso de Molina, Aqui comienca vn vocabulario",0
1208,miccatetl,[mikˈkaː.tet͡ɬ],"A stone placed over a grave; a gravestone or headstone.,",0
1209,miccatlatatactzaccayotl,[míkkaːt͡látatákt͡sakˈkáːjoːt͡ɬ],"(it is) a large grave stone or slab bearing an epitaph.,",0
1210,miccazayolin,/mik.kaː.saːˈjoː.lin/,(it is) a large bloodsucking fly known to transmit,0
1211,miccaçaioli,,Alternative spelling of miccazayolin,0
1212,miccaçayulin,,Alternative spelling of miccazayolin,0
1213,michacaxitl,[mi.t͡ʃaːˈká.ʃit͡ɬ],"(it is) a pond or pool contaning fish; a fishpond.,",0
1214,michahhuatl,[mit͡ʃˈaʔ.wat͡ɬ],"A long, thin fishbone or fish spine., 1555: Alonso",0
1215,michahxiliztli,[mi.t͡ʃaʔ.ʃiˈlís.t͡ɬi],"(it is) the catching of fish; fishing., 1555: Alonso",0
1216,michauatl,,Obsolete spelling of michahhuatl,0
1217,michaxiliztli,,Obsolete spelling of michahxiliztli,0
1218,michcoyolli,[mit͡ʃ.koˈjo.lːi],"A fishhook or a similar implement to catch fish., 1555:",0
1219,michcuyulli,,Obsolete spelling of michcoyolli,0
1220,michehuatl,[mit͡ʃˈeː.wat͡ɬ],"The scales or the skin of a fish., 1555: Alonso de",0
1221,micheuatl,,Obsolete spelling of michēhuatl,0
1222,michhuah,/mitʃwaʔ/,"(he or she is) one who has or holds fish., 1645, Horacio",0
1223,Michhuahcan,,Michoacán,0
1224,Michhuâ,,Alternative spelling of michhuah,0
1225,michin,[ˈmi.t͡ʃin̥],"fish, 1555, Alonso de Molina, Aqui comienca vn vocabulario",0
1226,michinix,[miˈt͡ʃi.niʃ],"wart, 1555: Alonso de Molina, Aqui comienca vn vocabulario",0
1227,michmaliztli,[mit͡ʃ.maˈlís.t͡ɬi],"(it is) the catching of fish or shellfish; fishing.,",0
1228,michmatlatl,[mit͡ʃˈmaː.t͡ɬat͡ɬ],"fishing net, 1555: Alonso de Molina, Aqui comienca",0
1229,michmecatl,/mit͡ʃˈmekat͡ɬ/,"fishing line, 1555: Alonso de Molina, Aqui comienca",0
1230,michmolli,[mit͡ʃˈmoː.lːi],"A stew or potage made from fish., 1571: Alonso de Molina,",0
1231,michmulli,,Obsolete spelling of michmōlli,0
1232,michnamacacan,[mit͡ʃ.naː.maˈka.kaːn],"A place where fish are sold; a fish market., 1571:",0
1233,michomitl,[mit͡ʃˈo.mit͡ɬ],"A thick fishbone or fish spine., 1555: Alonso de Molina,",0
1234,michtetl,[ˈmit͡ʃ.tet͡ɬ],"The spawn of a fish, a fish egg., 1555: Alonso de Molina,",0
1235,michtlaoyo,,Obsolete spelling of michtlaōyoh,0
1236,michtlaoyoh,[mit͡ʃ.t͡ɬaˈoː.joʔ],"An fish-stuffed, empanada-like pastry., 1571: Alonso",0
1237,michuâ,,Alternative spelling of michhuah,0
1238,michxoneuatl,,Obsolete spelling of mixxonēhuatl,0
1239,micqui,/ˈmik.ki/,"One that has died; a dead person or animal., 1571:",0
1240,mictia,,(transitive) To kill.,0
1241,mictihuetzi,/miktiwetsi/,"To fall to one's death., 1555: Alonso de Molina, Aqui",0
1242,mictiuetzi,,Alternative spelling of mictihuetzi,0
1243,mictlan,[ˈmik.t͡ɬaːn],"The underworld of Aztec mythology., 1555: Alonso de",0
1244,mictlancayotl,[mik.t͡ɬaːŋˈkaː.joːt͡ɬ],"Something infernal, hellish or chthonic., 1571: Alonso",0
1245,Mictlanteuctli,[mik.t͡ɬaːnˈteːkʷ.t͡ɬi],"An Aztec god, one of the Lords of the Night.",0
1246,mihlacatl,,Alternative spelling of millahcatl,0
1247,milcalatl,,"A kind of frog or toad., 1555: Alonso de Molina, Aqui",0
1248,millacatl,,Alternative spelling of millahcatl,0
1249,millahcatl,/miːllahkatɬ/,"farmer, peasant, 1555: Alonso de Molina, Aqui comienca",0
1250,millahtlacatl,[miː.lːaʔˈt͡ɬáː.kat͡ɬ],(he or she is) a person who works the land or inhabits,0
1251,milli,/miːlli/,Cultivated field; milpa.,0
1252,milpan,[ˈmíːɬ.pan̥],"(in) agricultural land; cultivated fields, the country.",0
1253,milpanecatl,[miːɬ.paˈnéː.kat͡ɬ],(he or she is) a person who works the land or inhabits,0
1254,miltepito,,Obsolete spelling of mīltepitōn,0
1255,miltepiton,[miːɬ.teˈpi.toːn],"Diminutive of mīlli; a small parcel of land., 1555:",0
1256,miltontli,[miːɬˈtoːn.t͡ɬi],"Diminutive of mīlli; a small parcel of land., 1555:",0
1257,mina,/ˈmiːna/,"(transitive) to shoot arrows, to pierce something",0
1258,miqui,/miki/,"(intransitive) To die., 1555: Alonso de Molina, Aqui",0
1259,miquiliztli,/mikiˈlis.t͡ɬi/,"death, 1571: Alonso de Molina, Vocabulario en lengua",0
1260,miquini,/mikini/,"A mortal., 1524: Bernardino de Sahagún, Coloquios y",0
1261,miquiztli,[miˈkis.t͡ɬi],(it is) the action of dying or the state of being dead;,0
1262,mitl,/ˈmiːt͡ɬ/,"arrow, dart, 1555: Alonso de Molina, Aqui comienca",0
1263,mitz-,,Object prefix for verbs; it indicates that the object is second-person singular; you,0
1264,mixincayotl,,Obsolete spelling of mixxīncāyōtl,0
1265,mixoneuatl,,Obsolete spelling of mixxonēhuatl,0
1266,mixtecatl,/miʃteːkatɬ/,A Mixtec.,0
1267,Mixtlan,,A community in the Aztec province of Tochtepec.,0
1268,mixtli,/miʃt͡ɬi/,"cloud., 1555: Alonso de Molina, Aqui comienca un vocabulario",0
1269,mixxincayotl,[mi.ʃːiːŋˈkaː.joːt͡ɬ],"The scales of a fish; fishskin., 1555: Alonso de Molina,",0
1270,mixxo,,Obsolete spelling of mixxoh,0
1271,mixxoh,[ˈmi.ʃːoʔ],"Something cloudy; covered in clouds., 1571: Alonso",0
1272,mixxonehuatl,[mi.ʃːonˈeː.wat͡ɬ],"The scales of a fish; fishskin., 1555: Alonso de Molina,",0
1273,mixxoneuatl,,Obsolete spelling of mixxonēhuatl,0
1274,miyahuatl,[miˈjaː.wat͡ɬ],"corn tassel
1571: Alonso de Molina, Vocabulario en lengua castellana y mexicana y mexicana y castellana, f. 59v. col. 1.
Eſpiga dela caña de mayz.miyauitl.
The spike of the cornstalk. miyauitl.
Idem, f. 55v. col. 2.
Miauatl. la eſpiga y flor dela caña del mayz.
Miauatl. the spike and flower of the cornstalk.",0
1275,miyahuatototl,[mi.jaː.waˈtoː.toːt͡ɬ],"lesser goldfinch (Spinus psaltria), Synonym: xōpantōtōtl,",0
1276,miyauatl,,Obsolete spelling of miyahuatl,0
1277,mizconetl,/miskoneːtɬ/,"A puma cub., 1555: Alonso de Molina, Aqui comienca",0
1278,mizquitl,/ˈmiskit͡ɬ/,"A mesquite tree.
1571: Alonso de Molina, Vocabulario en lengua castellana y mexicana y mexicana y castellana, f. 56r. col. 1
mizquitl. arbol de goma para tinta.",0
1279,miztli,/mist͡ɬi/,"Puma/cougar/mountain lion (Puma concolor)., 1555: Alonso",0
1280,mizto,,Alternative spelling of mizton,0
1281,mizton,[ˈmis.toːn],"Diminutive of miztli; a house cat., 1555: Alonso de",0
1282,miztontli,[misˈtoːn.t͡ɬi],"Diminutive of miztli; a little puma, a puma cub., 1555:",0
1283,mjchoaque,,Alternative spelling of michhuahqueh,0
1284,mo-,/mo/,"(personal prefix, possessive) Used to form the second-person",0
1285,mo-,/mo/,"(personal prefix, reflexive) Used to form the second",0
1286,mo-,/mo/,"(personal prefix, reflexive) Used to form the second",0
1287,mochi,,all,0
1288,molcaxitl,/moːlˈkaʃit͡ɬ/,"A small mortar for grinding chilis., A sauce bowl.",0
1289,molli,[ˈmoː.lːi],"A spiced, watery food of any kind; a sauce, stew, broth, etc.
c1558-1561: Bernardino de Sahagún, Primeros memoriales, f. 226.
tlaçotli mvlli
the precious sauces.",0
1290,motecçuma,,Alternative spelling of Moteuczoma,0
1291,moteohuan,[mo.teˈóː.waːn],second-person singular possessive plural of teōtl; (they are) your gods; deities.,0
1292,Moteuczoma,/moteːkʷsoːma/,"A male given name, Moctezuma/Montezuma., 1607, Chimalpahin,",0
1293,moteuhcçoma,,Alternative spelling of Moteuczoma,0
1294,motla,/ˈmoːt͡ɬa/,"(transitive) to stone something, to hunt something",0
1295,motohtli,,"A kind of squarriel, prairie dog.",0
1296,moxahua,/moʃaːwa/,"(reflexive) To put on traditional women's makeup.
1555: Alonso de Molina, Aqui comienca vn vocabulario en la lengua Castellana y Mexicana
Afeytarſe la muger al modo antiguo. ninoxaua.",0
1297,moxaua,,(reflexive) Alternative spelling of moxahua,0
1298,moyotl,/ˈmoːjoːt͡ɬ/,"mosquito
1555: Alonso de Molina, Aqui comienca vn vocabulario en la lengua castellana y mexicana, f. 176v.
Moſquito- moyotl.
(Mosquito- moyotl.)
1571: Alonso de Molina, Vocabulario en lengua castellana y mexicana y mexicana y castellana, f. 87r. col. 1.
Moſquito.moyotl.vel,muyotl.
(Mosquito.moyotl.vel,muyotl.)
1571: Alonso de Molina, Vocabulario en lengua castellana y mexicana y mexicana y castellana, f. 87r. col. 2.
Moxquito,cantor y çancudo. muyotl.
(Mosquito, singing and leggy. muyotl.)
1571: Alonso de Molina, Vocabulario en lengua castellana y mexicana y mexicana y castellana, f. 58v. col. 1.
Moyotl. moxquito.
(Moyotl. mosquito.)",0
1299,moztla,/moːstɬa/,"Tomorrow.
1555: Alonso de Molina, Aqui comienca un vocabulario en la lengua castellana y mexicana, f. 163v.
Mañana deſspues de oy. muztla. yciuh.",0
1300,muztla,,Alternative spelling of moztla,0
1301,mīllàcatl,,Alternative spelling of millahcatl,0
1302,nabox,[ˈnáː.poʃ],"(it is) a turnip., 1555: Alonso de Molina, Aqui comienca",0
1303,nacaayotl,[na.kaˈaː.joːt͡ɬ],"A stew or other dish made with meat., 1555: Alonso",0
1304,nacaceh,/ˈnakaseʔ/,"Someone or something that has ears., 16C: Bernardino",0
1305,nacamolli,/na.kaˈmoː.lːi/,"meat stew, 1571: Alonso de Molina, Vocabulario en lengua",0
1306,nacamulli,,Obsolete spelling of nacamōlli,0
1307,nacaocuilin,[na.ka.oˈkʷi.lin],"maggot, 1555: Alonso de Molina, Aqui comienca vn vocabulario",0
1308,nacatamalli,[na.ka.taˈmá.lːi],"(it is) a meat-filled tamal., 1571: Alonso de Molina,",0
1309,nacatl,/ˈnakatɬ/,"Meat; flesh.
1555: Alonso de Molina, Aqui comienca un vocabulario en la lengua castellana y mexicana, f. 45r.
Carne. nacatl.",0
1310,nacatlaolli,[na.ka.t͡ɬaˈoː.lːi],"A dish of cooked meat and grains of maize., 1571: Alonso",0
1311,nacatlaoyoh,[na.ka.t͡ɬaˈoː.joʔ],"A meat-filled, empanada-like pastry., 1571: Alonso",0
1312,nacatlapatzcaayotl,[na.ka.t͡ɬa.paːt͡s.kaˈaː.joːt͡ɬ],"meat juices, 1571: Alonso de Molina, Vocabulario en",0
1313,nacayo,,first-person singular inalienable possessive singular,0
1314,nacayo,,Obsolete spelling of nacayoh,0
1315,nacayo,,Obsolete spelling of nacayoh,0
1316,nacayoh,[naˈka.joʔ],"Something fleshy, meaty or brawny., 1571: Alonso de",0
1317,nacazcuihcuitlatl,[na.kas.kʷiʔˈkʷi.t͡ɬat͡ɬ],"earwax, 1555: Alonso de Molina, Aqui comienca vn vocabulario",0
1318,nacaztli,[naˈkas.t͡ɬi],"ear, 1555: Alonso de Molina, Aqui comienca vn vocabulario",0
1319,nahnahui,[naʔˈnáː.wi],"(distributive) four apiece; four each., 1555: Alonso",0
1320,nahualli,/naːˈwalli/,"sorcerer
1555: Alonso de Molina, Aqui comienca vn vocabulario en la lengua castellana y mexicana, f. 180v.
Nigromantico.  naualli.
A necromancer [a sorcerer].  nahualli.
1571: Idem, Vocabulario en lengua castellana y mexicana y mexicana y castellana, f. 63v. col. 1.
Naualli. bruxa.
Naualli. a witch.",0
1321,nahuallotl,[naːˈwa.lːoːt͡ɬ],"Sorcery; necromancy., 1555: Alonso de Molina, Aqui",0
1322,nahuatl,[ˈnaː.wat͡ɬ],"(it is) something having a clear and pleasant sound.,",0
1323,nahuatlahto,,Alternative spelling of nahuatlahtoh,0
1324,nahuatlahtoh,[naːwaˈtɬaʔtoʔ],"An interpreter., 1555: Alonso de Molina, Aqui comienca",0
1325,nahuatlahtolli,[naː.wa.tɬaʔ.ˈtoː.lːi],"(it is) the Nahuatl language., 1565, Alonso de Molina,",0
1326,nahuatlato,,Alternative spelling of nahuatlahtoh,0
1327,nahuatlatolli,,Alternative spelling of Nahuatlahtolli,0
1328,nahui,[ˈnáː.wi],"four, 1555: Alonso de Molina, Aqui comienca vn vocabulario",0
1329,nahuilhuitl,[naːˈwiɬ.wit͡ɬ],"A period of four days., 1555: Alonso de Molina, Aqui",0
1330,namictli,/naːˈmikt͡ɬi/,"A spouse; a husband or wife., 1571: Alonso de Molina,",0
1331,namique,,Obsolete spelling of nāmiqueh.,0
1332,namiqueh,[naːˈmí.keʔ],(he or she is) one who has a spouse; a married man,0
1333,nanacatl,/naˈnakat͡ɬ/,"mushroom, fungus, 1571: Alonso de Molina, Vocabulario",0
1334,nanahui,[naːˈnáː.wi],"(distributive) four at a time; by fours., 1555: Alonso",0
1335,nanaui,,Obsolete spelling of nānāhui.,0
1336,nanquilia,/naːnkiˈlia/,"(transitive) to answer, to respond to someone.",0
1337,nantli,[ˈnaːn.t͡ɬi],"(it is) a mother., 1555: Alonso de Molina, Aqui comienca",0
1338,nantontli,[naːnˈtoːn.t͡ɬi],"Diminutive of nāntli; a small womb., 1555: Alonso de",0
1339,nanyotl,[ˈnaːn.joːt͡ɬ],"womb, 1555: Alonso de Molina, Aqui comienca vn vocabulario",0
1340,nappa,[ˈnaːp.pa],"four times, 1571: Alonso de Molina, Vocabulario en",0
1341,nappohualli,[naːp.poːˈwa.lːi],"eighty, 1571: Alonso de Molina, Vocabulario en lengua",0
1342,nappohualpa,[naːp.poːˈwaɬ.pa],"eighty times, 1571: Alonso de Molina, Vocabulario en",0
1343,naranjaxocotl,,"orange
1555, Alonso de Molina, Aqui comienca vn vocabulario en la lengua Castellana y Mexicana
Piña fruta conocida. matzatli.",0
1344,naualli,,Alternative spelling of nahualli,0
1345,nauallotl,,Obsolete spelling of nāhuallōtl,0
1346,nauatl,,Obsolete spelling of nāhuatl,0
1347,nauatlato,,Alternative spelling of nahuatlahtoh,0
1348,nauatlatolli,,Alternative spelling of Nahuatlahtolli,0
1349,nauhpohualli,,Alternative spelling of nāppōhualli,0
1350,nauhxihuitl,[naːʍˈʃi.wit͡ɬ],"A period of four years., 1555: Alonso de Molina, Aqui",0
1351,naui,,Obsolete spelling of nahui,0
1352,nauilhuitl,,Obsolete spelling of nāhuilhuitl,0
1353,nealtilatl,[ne.aːɬˈtiː.laːt͡ɬ],"Water set aside for bathing; a bath, baths., 1555:",0
1354,nech-,/neːtʃ/,Object prefix for verbs; it indicates that the object is first-person singular; me,0
1355,neci,/neːsi/,(intransitive) To appear; become visible.,0
1356,necuatequilizteahpaztli,[nekʷaːteːkiliste.aʔˈpast͡ɬi],"(Catholicism) (it is) a baptismal font., 1571: Alonso",0
1357,necuatequiliztli,[nékʷatékiˈlíst͡ɬi],(Catholicism) (it is) the act of baptizing someone;,0
1358,necuatl,[ˈne.kʷaːt͡ɬ],"The unfermented, uncooked sap of the agave plant.,",0
1359,nehoatl,,Alternative spelling of nehhuatl,0
1360,nemanahuilcalli,[ne.maː.naː.wiːɬˈka.lːi],"latrine, toilet, 1555: Alonso de Molina, Aqui comienca",0
1361,nemanauilcalli,,Obsolete spelling of nemānāhuīlcalli,0
1362,nemekatilistli,,common-law marriage,0
1363,nemi,,to live (somewhere),0
1364,nemini,/ˈne.mi.ni/,"dweller, resident, inhabitant, 1571: Alonso de Molina,",0
1365,nenamictiliztli,/nenaːmiktiˈlist͡ɬi/,"marriage, wedlock",0
1366,nenepilli,,"tongue, 1555: Alonso de Molina, Aqui comienca vn vocabulario",0
1367,nenetl,,"doll
Synonyms: coconetl, cuauhcoconetl
1555 Alonso de Molina, Aqui comienca vn vocabulario en la lengua castellana y mexicana:
Muñeca de niños. quauhcoconetl. nenetl.",0
1368,nequi,/neki/,"(transitive) to want something, to desire",0
1369,netlapololtiliztli,/netɬapoloːltilistɬi/,"Confusion., 16C: Bernardino de Sahagún, Florentine",0
1370,netzolli,,choya (Opuntia tunicata),0
1371,neuctli,/nekti/,Honey.,0
1372,neuczayolin,,honey bee,0
1373,nexxo,,Obsolete spelling of nexxoh,0
1374,neyolmelaualoni,,Alternative spelling of neyolmelahualoni,0
1375,Neçahualpilli,,Alternative spelling of Nezahualpilli,0
1376,-ni,,Marks a verb's habitual or customary present tense.,0
1377,ni-,,Subject prefix for verbs; indicates that the subject is first person singular: I.,0
1378,nican,/nikaːn/,"Here., 1645: Horacio Carochi, Arte de la lengua mexicana",0
1379,nicca,/nikka/,"hello, what's up (greeting)",0
1380,niltze,/niltsɛ/,hello (greeting),0
1381,no-,/no/,"(personal prefix, possessive) Used to form the first-person",0
1382,no-,/no/,"(personal prefix, reflexive) Used to form the first-person",0
1383,no-,/no/,"(personal prefix, reflexive) Used to form the first-person",0
1384,nochehuatl,/noːt͡ʃˈeː.wat͡ɬ/,"The rind of a prickly pear., 1571: Alonso de Molina,",0
1385,nocheuatl,,Obsolete spelling of nōchēhuatl,0
1386,nocheztli,[noːˈt͡ʃes.t͡ɬi],"cochineal, 1555: Alonso de Molina, Aqui comienca vn",0
1387,nochoctli,[noːˈt͡ʃok.t͡ɬi],An alcoholic beverage made from the fermented juice,0
1388,nochtli,/ˈnoːt͡ʃ.t͡ɬi/,Prickly pear cactus fruit.,0
1389,nohpalli,/noʔpalːi/,"prickly pear cactus, nopal",0
1390,Nohpaltepec,,Nopaltepec,0
1391,noteohuan,[no.teˈóː.waːn],first-person singular possessive plural of teōtl; (they are) my gods; deities.,0
1392,nozo,,or,0
1393,nupalli,,Obsolete spelling of nohpalli,0
1394,-oa,/ˈoa/,"(transitive) Instrumental verbal suffix; usually, but not exclusively, appended to nouns to create verbs. Transitive counterpart of -ihui.",0
1395,occalli,[okˈká.lːi],"(it is) a place where pulque is made or stored, 1555,",0
1396,ocelocopile,,Alternative spelling of ocelocopileh,0
1397,ocelocopileh,,"One that has a conical jaguar-skin headpiece., 16C:",0
1398,ocelocopilli,,A conical jaguar-skin headpiece.,0
1399,oceloehuatl,[o.seː.loːˈeː.wat͡ɬ],"the skin or hide of a jaguar, 1571, Alonso de Molina,",0
1400,oceloeuatl,,Obsolete spelling of ocēlōēhuatl,0
1401,ocelome,,Obsolete spelling of ocēlōmeh,0
1402,ocelometl,/oˈseː.loːmetɬ/,Agave (Agave americana).,0
1403,ocelomichin,/oːˈseː.loːˈmit͡ʃin/,"Jaguar fish, guapote fish (Parachromis managuensis)",0
1404,ocelopetlatl,/oːseːloːpetɬatɬ/,"Jaguar-skin mat., 16C: Bernardino de Sahagún, ""Florentine",0
1405,ocelopilli,,"Jaguar warrior, jaguar knight.",0
1406,ocelotl,/o(ː)ˈseː.loːt͡ɬ/,"(it is) a jaguar  (Panthera onca)., 1571, Alonso de",0
1407,oceloxochitl,,tigridia,0
1408,oceloyotl,[oˈseː.loːjoːt͡ɬ],"grittiness, courage.",0
1409,ocelupetlatl,,Alternative spelling of ocelopetlatl,0
1410,ococallotl,[o.koːˈka.lːoːt͡ɬ],"lantern, 1571, Alonso de Molina, Vocabulario en lengua",0
1411,ococentli,[o.koːˈsen.t͡ɬi],"pine cone, 1571, Alonso de Molina, Vocabulario en lengua",0
1412,ococenyollohtli,[o.koː.sen.joːˈlːoʔ.t͡ɬi],"pine nut, 1571, Alonso de Molina, Vocabulario en lengua",0
1413,ococenyollotli,,Obsolete spelling of ocōcenyōllohtli,0
1414,ococuahuitl,[o.koːˈkʷa.wit͡ɬ],"pine tree, 1571, Alonso de Molina, Vocabulario en lengua",0
1415,ococuauhtlah,[o.koːˈkʷaʍ.t͡ɬaʔ],"a grove of pine trees, 1571, Alonso de Molina, Vocabulario",0
1416,ocoquauhtla,,Obsolete spelling of ocōcuauhtlah,0
1417,ocoquauitl,,Obsolete spelling of ocōcuahuitl,0
1418,ocotl,[ˈo.kot͡ɬ],"pine tree, pinewood torch, 1571, Alonso de Molina,",0
1419,ocozacatl,[o.koːˈsá.kat͡ɬ],"(it is) a bunch or bundle of pine needles, especially",0
1420,octlaliloyan,[ok.t͡ɬaː.liːˈlóː.jaːn̥],"(in) a place where pulque is made and stored, 1555,",0
1421,octli,/oktɬi/,"pulque
1555, Alonso de Molina, Aqui comienca vn vocabulario en la lengua Castellana y Mexicana
Vino generalmentei [sic] octli.",0
1422,ocuilin,/oˈkʷilin/,worm,0
1423,ocuillo,,Obsolete spelling of ocuilloh,0
1424,ocuilloh,[oˈkʷi.lːoʔ],"something wormy; infested with worms, 1571, Alonso",0
1425,ocuilto,,Obsolete spelling of ocuiltōn,0
1426,ocuilton,[oˈkʷiɬ.toːn],"Diminutive of ocuilin; a small weevil larva, 1555,",0
1427,ocxayotl,/okˈʃaːjoːt͡ɬ/,"lees, 1571, Alonso de Molina, Vocabulario en lengua",0
1428,ohcalli,/oʔˈká.lːi/,path; street,0
1429,ohococuauhtlah,[oʔ.o.koːˈkʷaʍ.t͡ɬaʔ],"a grove of pine trees, 1571, Alonso de Molina, Vocabulario",0
1430,ohocotlah,[oʔ.oˈkoː.t͡ɬaʔ],"a grove of pine trees, 1571, Alonso de Molina, Vocabulario",0
1431,ohome,[oʔˈóː.me],"(distributive) two apiece; two each, 1555, Alonso de",0
1432,ohtlatl,[ˈoʔt͜ɬat͜ɬ],"bamboo, cane",0
1433,ohxitl,[ˈoʔ.ʃit͡ɬ],"a turpentine-based unguent, 16th century, Bernardino",0
1434,ohza,/ˈoʔsa/,"(transitive) To anoint, to apply salve on something",0
1435,ollama,[oːˈlːá.ma],"(intransitive) to play with a rubber ball, especially",0
1436,olli,[ˈoː.lːi],"latex (sap of the rubber tree), 1571, Alonso de Molina,",0
1437,ollo,,Obsolete spelling of ōlloh,0
1438,olloh,[ˈoː.lːoʔ],"something filled with or bearing latex, 1571, Alonso",0
1439,olotl,/ˈoːloːt͡ɬ/,"heart (organ), Synonym: yōllōtl, 1571, Alonso de Molina,",0
1440,oloxochitl,/oːloːˈʃoːt͡ʃit͡ɬ/,"maize flower, tassel",0
1441,ome,[ˈóː.me],"two, 1555, Alonso de Molina, Aqui comienca vn vocabulario",0
1442,omicalli,[o.miˈka.lːi],"ossuary, 1555, Alonso de Molina, Aqui comienca vn vocabulario",0
1443,omilhuitl,[oːˈmiɬ.wit͡ɬ],"a period of two days, 1571, Alonso de Molina, Vocabulario",0
1444,omitl,/omitɬ/,Bone.,0
1445,ompa,,(locative) over there,0
1446,ompoalilhuitl,,Obsolete spelling of ōmpōhualilhuitl,0
1447,ompoalli,,Obsolete spelling of ōmpōhualli,0
1448,ompoalpa,,Obsolete spelling of ōmpōhualpa,0
1449,ompoualpa,,Obsolete spelling of ōmpōhualpa,0
1450,on,,(demonstrative) that; those,0
1451,oncah,/ˈonkaʔ/,"(intransitive) to exist, to be somewhere",0
1452,oncan,,there,0
1453,onxihuitl,[oːnˈʃi.wit͡ɬ],"a period of two years, 1571, Alonso de Molina, Vocabulario",0
1454,oocelo,,Obsolete spelling of ōocēloh,0
1455,oocoquauhtla,,Obsolete spelling of ohocōcuauhtlah,0
1456,oocotla,,Obsolete spelling of ohocōtlah,0
1457,oome,,"(distributive) two at a time; by twos, 1555, Alonso",0
1458,oome,,Obsolete spelling of ohōme.,0
1459,oome,,Obsolete spelling of ohōme.,0
1460,opochmaytl,,Obsolete spelling of ōpōchmāitl,0
1461,oquichcuacuahueh,[o.kit͡ʃ.kʷaːˈkʷa.weʔ],"bull, 1555, Alonso de Molina, Aqui comienca vn vocabulario",0
1462,oquichhuah,[oˈkít͡ʃ.waʔ],"(she is) a married woman; a woman who has a husband,",0
1463,oquichhuilotl,[o.kit͡ʃˈwiː.loːt͡ɬ],"a male pigeon or dove, 1555, Alonso de Molina, Aqui",0
1464,oquichotl,,Obsolete spelling of oquichchotl.,0
1465,oquichozomahtli,[o.kit͡ʃ.o.soˈmaʔ.t͡ɬi],"a male monkey, 1555, Alonso de Molina, Aqui comienca",0
1466,oquichoçomatli,,Obsolete spelling of oquichozomahtli,0
1467,oquichquaquaue,,Obsolete spelling of oquichcuācuahueh,0
1468,oquichtli,/okitʃtɬi/,"man; adult male human
16C, Bernardino de Sahagún, Primeros Memoriales
oquichtli. tlatequipanoa. chicaoac.
(Man: He works, he is strong.)
1571, Alonso de Molina, Vocabulario en lengua castellana y mexicana y mexicana y castellana, f. 77v. col. 2.
Oquichtin. varones.
(Oquichtin. men, males.)",0
1469,oquichua,,Obsolete spelling of oquichhuah.,0
1470,oquichuilotl,,Obsolete spelling of oquichhuīlōtl,0
1471,oquichyutl,,Obsolete spelling of oquichchotl.,0
1472,otlatl,,Obsolete spelling of ohtlatl,0
1473,otli,,Alternative spelling of ohtli,0
1474,otomi,,Alternative spelling of otomih,0
1475,otomitl,/otomitɬ/,"An Otomi.
17C: Crónica Mexicayotl
auh in yehuantin yn oncan chaneque yn otomi. çan quinmotetzanhuia
(But the [local] inhabitants, the Otomí, considered them an evil portent.)
1645: Horacio Carochi, Arte de la lengua mexicana con la declaración de los adverbios della, f. 4r
Otomitl, de nacion Otomi [...] Otomî",0
1476,Otomitl,,Alternative spelling of otomitl,0
1477,Otomî,,Alternative spelling of otomih,0
1478,otontlahtolli,,Otomi language,0
1479,otztli,/oːtstɬi/,A pregnant woman.,0
1480,ouicayotl,,Obsolete spelling of ohuihcāyōtl,0
1481,oxinamacac,,"A seller of turpentine., 16C: Bernardino de Sahagún,",0
1482,oxinamacaque,,Alternative spelling of oxinamacaqueh,0
1483,oxitl,,alternative or obsolete spelling of ohxitl,0
1484,oyametl,/oˈjamet͡ɬ/,"sacred fir (Abies religiosa)
1571, Alonso de Molina, Vocabulario en lengua castellana y mexicana y mexicana y castellana, f. 76r. col. 1.
Oyametl. abeto arbol de que ſe coge el olio de aueto.
(Oyametl. fir tree from which fir oil is drawn.)",0
1485,ozomahtli,[o.soˈmáʔ.t͡ɬi],"(it is a) monkey.
1555, Alonso de Molina, Aqui comienca vn vocabulario en la lengua castellana y mexicana, f. 129v.
Gatopaus.   uçumatli.
A certain type of monkey. uçumatli.
Idem, f. 174v.
Mona animal conocido.   oçumatli.quauhchimal.
A monkey, a known animal. oçumatli. quauhchimal.
1571, Idem, Vocabulario en lengua castellana y mexicana y mexicana y castellana, f. 86r. col. 2.
Mona animal conocido. oçumatli. quauhchimal.
A monkey, a known animal. oçumatli. quauhchimal.
Idem, f. 76r. col. 1.
Oçumatli. mico, o ximia.
Oçumatli. a monkey, or a female simian.",0
1486,ozomatli,,Alternative spelling of ozomahtli,0
1487,oztoatl,,fox (mammal),0
1488,oztotl,/oːstoːt͡ɬ/,"cave
1555, Alonso de Molina, Aqui comienca un vocabulario en la lengua castellana y mexicana, f. 46v.
Cauerna cueua. oztotl.",0
1489,oçelotl,,Alternative spelling of ocelotl,0
1490,oçomahtli,,Alternative spelling of ozomahtli,0
