ID,Form,IPA,Gloss,Language_ID
633,cozcacuauhtli,[koːs.kaˈkʷaːʍ.t͡ɬi],"the king vulture, Sarcoramphus papa, 1555, Alonso de",0
634,cozcaquauhtli,,Obsolete spelling of cozcacuauhtli,0
635,Cozcatlan,,El Salvador (a country in Central America),0
636,cozehuatl,,boot.,0
637,coztic,,yellow,0
638,cozticteocuitlaoztotl,/kostikte.oːkʷitɬa.oːstoːtɬ/,"Goldmine., 1555: Alonso de Molina, Aqui comienca un",0
639,coçamalotl,,Obsolete spelling of cōzamālōtl,0
640,cua,/kʷa/,(transitive) To eat.,0
641,cuachicpalli,[kʷaːt͡ʃ.ikˈpa.lːi],"cushion, pillow, 1555: Alonso de Molina, Aqui comienca",0
642,cuachihchil,[kʷaːˈt͡ʃiʔ.t͡ʃiːɬ],"house finch, 1571: Alonso de Molina, Vocabulario en",0
643,cuachpamitl,/kʷaːt͡ʃˈpaːmit͡ɬ/,"standard, banner, flag, 1555: Alonso de Molina, Aqui",0
644,cuachtli,/ˈkʷaːt͡ʃt͡ɬi/,A large cotton blanket or sheet.,0
645,cuacuahueh,,cow,0
646,cuacuahuitl,/kʷaːˈkʷawit͡ɬ/,"antler, horn, 1555: Alonso de Molina, Aqui comienca",0
647,cuacuauhxolotl,,"Bison, bufalo.",0
648,cuahcuauhtlah,[kʷaʔˈkʷaw.t͡ɬaʔ],"A forest, grove or other wooded area., 1555: Alonso",0
649,cuahuitl,[ˈkʷá.wit͡ɬ],"(it is) a shrub; tree or other woody plant.
1555: Alonso de Molina, Aqui comienca un vocabulario en la lengua castellana y mexicana, f. 22v.
Arbol generalmente. quauitl.",0
650,cuaitl,/kʷaː.itɬ/,head (body part),0
651,cualani,/kʷaˈlaːni/,(intransitive) To get angry.,0
652,cualantli,/kʷaˈlaːnt͡ɬi/,Anger,0
653,cualli,,Something good; a good thing.,0
654,cualnemiliztli,,"good life, good way of living",0
655,cuamana,/kʷaːˈmana/,(transitive) to lie to or deceive something,0
656,cuamatlatl,,"cap, hat.",0
657,cuamiztin,,Alternative spelling of cuauhmiztin,0
658,cuamiztli,,Alternative spelling of cuauhmiztli,0
659,cuammaitl,[kʷamˈmaː.it͡ɬ],"tree branch, 1555: Alonso de Molina, Aqui comienca",0
660,cuammimiltontli,[kʷam.mi.miɬˈtoːn.t͡ɬi],"Diminutive of cuammimilli; a short pole, a club or",0
661,cuammitl,[ˈkʷam.miːt͡ɬ],"lever, 1555: Alonso de Molina, Aqui comienca vn vocabulario",0
662,cuammiztli,,Alternative spelling of cuauhmiztli,0
663,cuanaca,/kʷaːnaka/,"Chicken., 1547: Andrés de Olmos, Arte para aprender",0
664,cuanacatl,,comb.,0
665,cuappantontli,[kʷap.paːnˈtoːn.t͡ɬi],"Diminutive of cuappāntli; a small wooden bridge., 1555:",0
666,cuappatolli,[kʷap.paˈtoː.lːi],"chess, 1571: Alonso de Molina, Vocabulario en lengua",0
667,cuauhcalli,[kʷaʍˈka.lːi],"A large wooden cage used as a prison., 1555: Alonso",0
668,cuauhcaltepiton,[kʷaʍ.kaɬ.teˈpi.toːn],"Diminutive of cuauhcalli; a small wooden cage., 1571:",0
669,cuauhcaltontli,[kʷaʍ.kaɬˈtoːn.t͡ɬi],"Diminutive of cuauhcalli; a small wooden cage., 1571:",0
670,cuauhchimal,[kʷaʍˈt͡ʃiː.maɬ],"monkey, black howler (Alouatta pigra), 1555: Alonso",0
671,cuauhchimalli,[kʷaʍ.t͡ʃiːˈma.lːi],"wooden shield, 1555: Alonso de Molina, Aqui comienca",0
672,cuauhchiquihuitl,[kʷáʍt͡ʃiˈkíwit͡ɬ],"(it is) a wooden basket., 1571: Alonso de Molina, Vocabulario",0
673,cuauhcoconetl,[kʷaʍ.koːˈko.neːt͡ɬ],"wooden doll, 1555: Alonso de Molina, Aqui comienca",0
674,cuauhcomitl,,"barrel, 1555, Alonso de Molina, Aqui comienca vn vocabulario",0
675,cuauhconetl,[kʷaːʍˈko.neːt͡ɬ],"eaglet, 1555: Alonso de Molina, Aqui comienca vn vocabulario",0
676,cuauhehuatl,[kʷawˈeː.wat͡ɬ],"bark, tree bark, 1555: Alonso de Molina, Aqui comienca",0
677,cuauhhuatzalli,[kʷaʍ.waːˈt͡sa.lːi],"A piece of dry wood; a stick or a log., 1555: Alonso",0
678,cuauhhuatzaltontli,[kʷaʍ.waː.t͡saɬˈtoːn.t͡ɬi],"Diminutive of cuauhhuātzalli; a small stick, a twig.,",0
679,cuauhicpalli,[kʷaw.ikˈpa.lːi],"A wicker seat or chair., 1571: Alonso de Molina, Vocabulario",0
680,cuauhitzcuintli,[kʷa.wit͡sˈkʷín.t͡ɬi],"(it is) a low wooden stool., 1555: Alonso de Molina,",0
681,cuauhiztexochitl,/kʷaːwisteʃoːtʃitɬ/,"A kind of flower., 16C: Bernardino de Sahagún, Florentine",0
682,cuauhmiztli,/kʷawmistɬi/,"Jaguarundi (Puma yagouarondi)., c1600: ""Anónimo Mexicano"",",0
683,Cuauhnahuac,/kʷaɸ.ˈnaː.wak/,Cuernavaca (the capital city of the modern state of,0
684,cuauhnanacatl,[kʷaʍ.naˈna.kat͡ɬ],"A mushroom that grows on trees., 1555: Alonso de Molina,",0
685,cuauhnexatl,[kʷaʍˈnéʃaːt͡ɬ],"(it is) a beverage of boiled maize and ashes., 1571:",0
686,cuauhocuilin,[kʷaʍ.oˈkʷi.lin],"woodworm, 1555: Alonso de Molina, Aqui comienca vn",0
687,cuauhpatolli,[kʷaʍ.paˈtoː.lːi],"chess, 1555: Alonso de Molina, Aqui comienca un vocabulario",0
688,cuauhpilli,,"Eagle warrior, eagle knight.",0
689,Cuauhtemallan,/kʷawteːmallaːn/,"Iximche, a Kaqchikel kingdom in what is now Guatemala,",0
690,cuauhtentetl,/kʷaːwteːntetɬ/,"A lip plug in the shape of an eagle., 1558–1561 Bernardino",0
691,cuauhtequi,,"To chop wood., To cut down trees.",0
692,cuauhtetl,,Eagle egg,0
693,cuauhtla,,Obsolete spelling of cuauhtlah,0
694,cuauhtlah,[ˈkʷaw.t͡ɬaʔ],"(in) a forest, grove or other wooded area., 1555: Alonso",0
695,Cuauhtlah,,"Cuauhtla (the largest city in the modern state of Morelos,",0
696,Cuauhtlahtoatzin,[kʷaːʍ.t͡ɬáʔ.toˈáː.t͡sin̥],"(honorific) A male given name, roughly “he is who speaks",0
697,cuauhtlapantli,/kʷawˈt͜ɬapant͡ɬi/,A bower; a shelter made from branches.,0
698,cuauhtli,[ˈkʷaːʍ.t͡ɬi],"eagle
1555: Alonso de Molina, Aqui comienca vn vocabulario en la lengua castellana y mexicana, f. 11r.
Aguila.  quauhtli.
An eagle. quauhtli.
1571: Idem, Vocabulario en lengua castellana y mexicana y mexicana y castellana, f. 87v. col. 1.
Quauhtli. aguila.
Quauhtli. an eagle.
c1600: Unknown, Anónimo mexicano, f. 7r.
oquitlalílique miec ytlahuitol, ce cuauhtlí tlacuicuítl, […]
They buried him with very many of his things: his bow, an eagle carved of wood, […]
1645: Horacio Carochi, Arte de la lengua mexicana con la declaración de los adverbios della, f. 128r.
Quāuhtli, 1. larga, el Aquila.
Quāuhtli, [with the] first [vowel] long, the eagle.",0
699,cuauhtontli,[kʷaʍˈtoːn.t͡ɬi],"Diminutive of cuahuitl; a small stick, a twig., 1555:",0
700,cuauhtotolin,/kʷawtoːˈtolin/,"Crested Guan, Penelope purpurascens., c1600: Anonymous,",0
701,cuauhyotl,,"grittiness, eagle courage.",0
702,cuaxochtli,,Boundary.,0
703,Cuba,,Cuba (an island and country in the Caribbean),0
704,cucuxqui,,Alternative spelling of cocoxqui,0
705,cue,/kʷɛ/,(mild exclamation),0
706,cuecuechmictia,,"(transitive) To hound; harass.
1555: Alonso de Molina, Aqui comienca un vocabulario en la lengua castellana y mexicana, f. 245v.
ACoſſar a alguno. nite,cuecuechmictia.",0
707,cuehzoa,/kʷeʔˈsoa/,"(transitive) to disturb, to bother",0
708,cueiatl,,Alternative spelling of cueyatl,0
709,cueitl,[ˈkʷeː.it͡ɬ],"skirt, petticoat (woman's clothing)
1571: Alonso de Molina, Vocabulario en lengua castellana y mexicana y mexicana y castellana, f. 16r. col. 1.
Cueitl. ſaya,faldellin,faldillas., o naguas.
Cueitl. a skirt, a short skirt, a petticoat or an underskirt.",0
710,cuemitl,/ˈkʷemit͡ɬ/,Cultivated land; field.,0
711,cuepa,/kʷepa/,"(transitive) To turn.
1555: Alonso de Molina, Aqui comienca un vocabulario en la lengua castellana y mexicana, f. 35r.
Boluer algo dela otra parte. nitla,cuepa.
16C: Bernardino de Sahagún, Florentine Codex, book 1
yn acalli qujcuepa, qujxtlapachcuepa, queoatiquetza, ca aco maiauj, ca tema.
(She upset the boat, overturned it, lifted it up, tossed it up, plunged it in the water.)
1645: Horacio Carochi, Arte de la lengua mexicana con la declaración de los adverbios della, f. 92v.
Si S. Lorenço hablara en Mexicano con el Tirano, el dixera: ca ye ōtléhuāc izcentlapal noyōmòtlan: xitlanahuati, mā nechcuepacān, inic nitléhuāquiz in occentlapal [...] ya està assado vn lado de mis costados, manda que me bueluan, para que se asse el otro
(If St. Lawrence talked in Mexican with the tyrant, he would say, [...] One side of my flanks is already roasted, order them to turn me so the other side will be roasted)",0
712,cuepcayotl,,"return, change, the opposite",0
713,cueponi,/kʷepoːni/,(intransitive) To bloom.,0
714,cuetlachtli,/kʷetɬaːtʃtɬi/,Wolf,0
715,cuetlauhqui,/kʷetɬawki/,"Withered., 1555: Alonso de Molina, Aqui comienca vn",0
716,Cuetlaxcoapan,,Puebla City (the capital and largest city of the modern,0
717,cuetlāchtli,,Alternative spelling of cuetlachtli,0
718,cuetzpalin,[kʷet͡sˈpa.lin̥],"lizard, 1555: Alonso de Molina, Aqui comienca vn vocabulario",0
719,cuexcochtli,[kʷeʃˈkót͡ʃ.t͡ɬi],(anatomy) (it is) the nape of the neck.,0
720,Cuextecapan,,Huasteca,0
721,cueyamolli,[kʷéjaˈmóːlːi],"(it is) a stew of frog meat., 1571: Alonso de Molina,",0
722,cueyamulli,,Obsolete spelling of cueyamōlli,0
723,cueyatl,[ˈkʷéjat͡ɬ],"(it is) a frog.
1555: Alonso de Molina, Aqui comienca un vocabulario en la lengua castellana y mexicana, f. 208r.
Rana. cueyatl.cuiyatl.acacuiyatl.
16C: Bernardino de Sahagún, Florentine Codex, book 1
Auh in pipiltotonti muchintin qujntlaxqujaia: yn aca coatl: cujiatl, xoujli, axolotl, tototl
(And all the little children roasted some snakes, frogs, small white fish, the axolotl, birds)
c1609: Chimalpahin, Cronica mexicayotl, f. 26r
yhuan ye quixinachohua yn mimichtin. yn cueyame. yn axollome. yn acociltin. aneneztin. ahuihuitlame yn axaxayacatl. yn quatecomatl. yoyolli.
(And fish now bred, and frogs, salamanders, crayfish, draonfly, larvae, swamp worms, winged water insects, [other] insects)",0
724,cuezcomatl,[kʷesˈko.mat͡ɬ],a large earthen vessel used to store grain,0
725,cui,,(transitive) To take.,0
726,cuicaamatl,[kʷiː.kaˈáː.mat͡ɬ],"(it is) a songbook., 1555: Alonso de Molina, Aqui comienca",0
727,cuicani,/kʷiːkani/,Singer.,0
728,cuicanitototl,[kʷiː.ka.niˈtoː.toːt͡ɬ],"songbird, 1571: Alonso de Molina, Vocabulario en lengua",0
729,cuicatl,[ˈkʷiː.kat͡ɬ],"song, 1555: Alonso de Molina, Aqui comienca vn vocabulario",0
730,cuichcho,,Obsolete spelling of cuichchoh,0
731,cuicho,,Obsolete spelling of cuichchoh,0
732,cuicuicanito,,Obsolete spelling of cuīcuīcanitōn,0
733,cuicuicaniton,[kʷiː.kʷiː.kaˈni.toːn],"Diminutive of cuīcuīcani; a small cricket., 1555: Alonso",0
734,cuicuitlayo,,Obsolete spelling of cuīcuitlayoh,0
735,cuicuitlayoh,[kʷiː.kʷiˈt͡ɬa.joʔ],"Something full of or covered in excrement., 1571: Alonso",0
736,cuicuitzcaconetl,/kʷiːkʷiːt͡skaˈkoneːt͡ɬ/,"A swallow chick or hatchling., 1555: Alonso de Molina,",0
737,cuicuitzcatl,/kʷiːkʷiːtskatɬ/,"Swallow.
1555: Alonso de Molina, Aqui comienca un vocabulario en la lengua castellana y mexicana, f. 131r.
Golondrina.cuicuitzcatl.
16C: Bernardino de Sahagún, Florentine Codex, book 11, chapter 2, paragraph 3
CUJCUJTZCATL: tliltontli, tenvitzpil, xopapachton [etc.]
(Barn swallow: It is small and black, with small, pointed bill, with small, short legs.)
1645: Horacio Carochi, Arte de la lengua mexicana con la declaracion de los adverbios della, f. 4r.
cuīcuītzcatl, golondrina: cuīcuītzcámê, golondrinas.",0
738,cuiiatl,,Alternative spelling of cueyatl,0
739,cuiloni,,"The passive partner in anal sex., 1555: Alonso de Molina,",0
740,cuilonyotl,[kʷiˈló.jːoːt͡ɬ],"(it is) male homosexuality, or a male homosexual act.,",0
741,cuitlacalli,/kʷi.t͡ɬaˈka.lːi/,"latrine, toilet, 1555: Alonso de Molina, Aqui comienca",0
742,cuitlacomitl,/kʷi.t͡ɬaˈkoː.mit͡ɬ/,"chamber pot, urinal, 1555: Alonso de Molina, Aqui comienca",0
743,cuitlapilli,/kʷiˈt͡ɬapilli/,"tail, rear, 1571,  Alonso de Molina,  Vocabulario en",0
744,cuitlatl,/kʷit͡ɬat͡ɬ/,"Excrement; feces., 1555: Alonso de Molina, Aqui comienca",0
745,cuitlatlotli,,"A kind of bird., 1555: Alonso de Molina, Aqui comienca",0
746,cuitlaxcolli,/kʷitɬaʃkolli/,intestines,0
747,cuitlayo,,Obsolete spelling of cuitlayoh,0
748,cuitlayoh,[kʷiˈt͡ɬa.joʔ],"Something full of or covered in excrement., 1571: Alonso",0
749,cuix,/kʷiʃ/,Used to introduce questions.,0
750,cuixin,,Kite.,0
751,cuiyatl,,Alternative spelling of cueyatl,0
752,cuyutl,,Obsolete spelling of coyotl,0
753,cuzcaquauhtli,,Obsolete spelling of cōzcacuāuhtli,0
754,cuā,,(transitive) To eat.,0
755,cuīcuītzcatl,,Alternative spelling of cuicuitzcatl,0
756,cītlalli,,Alternative form of citlalin,0
757,diezmo,[tiˈjeːʃ.moʔ],(Christianity) tithe,0
758,Dios,[ˈtí.joːʃ],"The Christian God., 1547, Andrés de Olmos, Arte para",0
759,discipulo,[tíʃiːˈpólo(ʔ)],(Christianity) (he is) a disciple; one of the Twelve,0
760,ecamecatl,,Obsolete spelling of ehcamecatl,0
761,ecapaquauhtla,,Obsolete spelling of ehcapahcuauhtlah,0
762,ecapatli,,Obsolete spelling of ehcapahtli,0
763,eecatl,,Obsolete spelling of ehēcatl,0
764,eecayo,,Obsolete spelling of ehēcayoh,0
765,eezço,,Obsolete spelling of ehezzoh,0
766,eeço,,Obsolete spelling of ehezzoh,0
767,Egipto,,Egypt,0
768,-eh,/-eʔ/,"(added to nouns) possessor, owner; indicates a noun that possesses the root noun, either as property or as an attribute.",0
769,ehcamecatl,[eʔ.kaˈme.kat͡ɬ],"A lengthy and prolix discourse about diverse topics.,",0
770,ehcapahcuauhtlah,[eʔ.ka.paʔˈkʷaʍ.t͡ɬaʔ],"A grove or forest of laurel-like trees., 1555, Alonso",0
771,ehcapahtli,[eʔ.kaˈpaʔ.t͡ɬi],"A laurel-like, medicinal tree; possibly Senna occidentalis.,",0
772,ehcaxoctli,[eʔ.kaˈʃók.t͡ɬi],"(it is) a light breeze., 1555, Alonso de Molina, Aqui",0
773,ehco,/ˈeʔko/,(intransitive) to arrive,0
774,ehecatl,[eʔˈeː.kat͡ɬ],"air, 1555, Alonso de Molina, Aqui comienca vn vocabulario",0
775,ehecatocatl,,camel spider,0
776,ehecayo,,Obsolete spelling of ehēcayoh,0
777,ehecayoh,[eʔ.eːˈka.joʔ],"Something windy., 1555, Alonso de Molina, Aqui comienca",0
778,ehehcatl,,Alternative spelling of ehecatl,0
779,ehezzoh,[eʔˈe.sːoʔ],"Something bloody; full of or covered in blood., 1555,",0
780,ehua,,(intransitive) to depart,0
781,ehuaamatl,[eː.waˈaː.mat͡ɬ],"parchment, 1555, Alonso de Molina, Aqui comienca vn",0
782,ehuatl,/ˈeːwat͡ɬ/,"skin (of humans, animals, fruit)
1555, Alonso de Molina, Aqui comienca vn vocabulario en la lengua castellana y mexicana, f. 196r.
Piel o pellejo. euatl.euayotl.
(Skin or hide euatl. euayotl.)
1571, Alonso de Molina, Vocabulario en lengua castellana y mexicana y mexicana y castellana, f. 21v. col. 1.
Euatl. cuero por curtir, o mondadura y caxcara de fruta.
(Euatl. hide yet to be tanned, or parings and peel of a fruit.",0
783,ehuatlapitzalli,,bagpipe,0
784,ehēcatl,/eʔˈeːkatɬ/,wind,0
785,ei,,Obsolete spelling of ēyi,0
786,eilhuitl,,Obsolete spelling of ēyilhuitl,0
787,elchiquihuitl,/eːlt͡ʃiˈkiwit͡ɬ/,"chest, breast, 1571, Alonso de Molina, Vocabulario",0
788,elefante,,elephant.,0
789,elehuia,/eːleːwi.a/,(transitive) To desire.,0
790,elimiqui,/eːliˈmiki/,to cultivate land,0
791,elli,[ˈéːlːi],"(it is) the liver.
1571: Alonso de Molina, Vocabulario en lengua castellana y mexicana y mexicana y castellana, pt 1, f. 28v. col. 2.
Elli. el hígado.
Elli. the liver.
1571: Idem, Vocabulario en lengua castellana y mexicana y mexicana y castellana, pt 2, f. 71r. col. 1.
Higado. eltapachtli. teltepach. elli. tel.
The liver. eltapachtli. teltepach. elli. tel.",0
792,ellotl,[ˈéːlːoːt͡ɬ],"(it is) diligence; industriousness, 1571: Alonso de",0
793,elmatlatl,[eːɬˈmáːt͡ɬat͡ɬ],"(it is) the mesentery., 1571: Alonso de Molina, Vocabulario",0
794,elotl,/ˈeːloːt͡ɬ/,"A tender ear of maize., 1571, Alonso de Molina, Vocabulario",0
795,elozacatl,,"A kind of plant., 16C: Bernardino de Sahagún, Florentine",0
796,eloçacatl,,Obsolete spelling of elozacatl,0
797,emilla,,Obsolete spelling of emīllah,0
798,emillah,[eˈmiː.lːaʔ],"A place cultivated with beans; with numerous bean fields.,",0
799,emilli,[eˈmiː.lːi],"A bean field; land cultivated with beans., 1571, Alonso",0
800,epahuaxtli,[e.paːˈwaʃ.t͡ɬi],"cooked beans, 1571, Alonso de Molina, Vocabulario en",0
801,epatl,/epatɬ/,"Skunk., 16C: Bernardino de Sahagún, Florentine Codex,",0
802,epauaxmulli,,Obsolete spelling of epāhuaxmōlli,0
803,epauaxtli,,Obsolete spelling of epāhuaxtli,0
804,epazotl,[eˈpa.soːt͡ɬ],epazote,0
805,epazoyoh,/eˈpasoːjoʔ/,"Something having much epazote, or smelling of epazote.,",0
806,epaçotl,,Obsolete spelling of epazōtl,0
807,eptapalcatl,,"Nacre; mother-of-pearl., 1555, Alonso de Molina, Aqui",0
808,eptli,[ˈep.t͡ɬi],"oyster
1555, Alonso de Molina, Aqui comienca vn vocabulario en la lengua castellana y mexicana, f. 185v.
Oſtia peſcado.  amatzcalli. eptli.
An osyter, the fish.  amatzcalli. eptli.
1571, Idem, Vocabulario en lengua castellana y mexicana y mexicana y castellana, f. 91r. col. 2.
Oſtia peſcado. amatzcalli. eptli.
An osyter, the fish. amatzcalli. eptli.
Idem, f. 29r. col. 1.
Eptli.concha, o oſtia dela mar.
Eptli. a shell, or an oyster of the sea.
16c, Bernardino de Sahagún, Florentine Codex, book 11, chapter 3, paragraph 3
EPTLI: çan no iehoatl in atzcalli, iehoatl in tapalcaiotl in omjtl, in petlanj, in peetlaca.",0
809,epyollohtli,[ep.joːˈlːoʔ.t͡ɬi],"pearl, seed pearl, 1555, Alonso de Molina, Aqui comienca",0
810,epyollotli,,Obsolete spelling of epyōllohtli,0
811,etamalli,,bean tamale.,0
812,etextli,[eˈteʃ.t͡ɬi],"Dough made from ground beans., 1571, Alonso de Molina,",0
813,etic,/etiːk/,heavy,0
814,etiliztli,[e.tiˈlis.t͡ɬi],"weight, heaviness, 1571, Alonso de Molina, Vocabulario",0
815,etl,[et͡ɬ],"bean
1547, Andrés de Olmos, Arte para aprender la lengua mexicana, ed. by Rémi Siméon (1875)
etl, frisoles, neuh, mis frisoles
etl, beans, neuh, my beans
1571, Alonso de Molina, Vocabulario en lengua castellana y mexicana y mexicana y castellana, f. 64r. col. 2.
Friſol. etl.
A bean. etl.
Idem, f. 29r. col. 2.
Etl. friſol, o haua.
Etl. a bean.",0
816,etla,,Obsolete spelling of etlah,0
817,etlah,[ˈe.t͡ɬaʔ],"A bean field; land cultivated with beans., 1571, Alonso",0
818,etzatl,[ˈeːtsa.t͡ɬ],Wasp.,0
819,exotl,[ˈe.ʃoːt͡ɬ],"green beans, 1571: Alonso de Molina, Vocabulario en",0
820,expa,/eːʃpa/,"Thrice; three times., 1645: Horacio Carochi, Arte de",0
821,eyi,[ˈéː.ji],"three, 1555: Alonso de Molina, Aqui comienca vn vocabulario",0
822,eyilhuitl,[eːˈjiɬ.wit͡ɬ],"A period of three days., 1571: Alonso de Molina, Vocabulario",0
823,eyluitl,,Obsolete spelling of ēyilhuitl,0
824,ezhuia,/eswi.a/,"(transitive) To bloody; make bloody; cover in blood.,",0
825,eztli,[ˈes.t͡ɬi],"Blood., 1555: Alonso de Molina, Aqui comienca un vocabulario",0
826,ezyoh,,Alternative spelling of ezzoh,0
827,ezzoh,/essoʔ/,"(someone/something) bloody, covered in blood., (someone/something)",0
828,eço,,Obsolete spelling of ezzoh,0
829,Gallitlalpan,,France[1],0
830,granadaxocotl,,"pomegranate
1555, Alonso de Molina, Aqui comienca vn vocabulario en la lengua Castellana y Mexicana
Piña fruta conocida. matzatli.",0
831,Guadalupe,[wátaˈlóːpeʔ],"(Christianity) (she is) Our Lady of Guadalupe., A female",0
832,-h,/-ʔ/,Used to form the plural of absolutive noun forms.,0
833,-h,/-ʔ/,"Forms the plural of verbs. Only used for animate subjects.,",0
834,-h,/-ʔ/,"Forms the plural of verbs. Only used for animate subjects.,",0
835,hamoli,,Obsolete spelling of ahmōlli,0
836,he,[é],"an expression of physical pain; ouch., 1571: Alonso",0
837,hecamecatl,,Obsolete spelling of ehcamecatl,0
838,hicox,[ˈíː.koʃ],"(it is) a fig., 1555: Alonso de Molina, Aqui comienca",0
839,hicoxcuahuitl,[iː.koʃˈkʷá.wit͡ɬ],"(its is) a fig tree., 1555: Alonso de Molina, Aqui",0
840,hicoxcuauhtlah,[iː.koʃˈkʷáʍ.t͡ɬaʔ],"(in) a grove of fig trees., 1555: Alonso de Molina,",0
841,hicoxquauhtla,,Obsolete spelling of īcoxcuauhtlah,0
842,hicoxquauitl,,Obsolete spelling of īcoxcuahuitl,0
843,hitacatl,,Alternative spelling of ihtacatl,0
844,hitetl,,Alternative spelling of ihtetl,0
845,hititl,,Alternative spelling of ihtetl,0
846,home,,(Codex Magliabechiano) Obsolete spelling of ōme,0
847,huacax,,cow,0
848,-huah,[-waʔ],"(appended to nouns) a possessive suffix; indicates the possessor or owner of the root word.
āxcāitl (“goods; riches”) → āxcāhuah (“he who has riches; a wealthy man”)
michin (“a fish”) → michhuah (“he who has fish; a fisher”)
tlācatl (“a person”) → tlācahuah (“he who owns a person; a slaveowner”)",0
849,-huahqueh,[-ˈwá.keʔ],plural of -huah,0
850,hualtemo,/ˈwaːltemoː/,"to come down, descend, 1571, Alonso de Molina, Vocabulario",0
851,hualtemoliztli,/waːlteˈmoːlist͡ɬi/,"descent, 1571, Alonso de Molina, Vocabulario en lengua",0
852,-huan,/-waːn/,"Used to form the plural of animate nouns in the possessive form.
tonān (“our mother”) → tonāhuān (“our mothers”)
notēouh (“my god”) → noteōhuān (“my gods”)
īmāchcōcōl (“their ancestor”) → īmāchcōcōlhuān (“their ancestors”)",0
853,huan,,and,0
854,huapahua,/waˈpaːwa/,(transitive) to strengthen to raise a child,0
855,huauhquiltamalli,[waʍ.kiɬ.taˈma.lːi],A tamale cooked with wild amaranth leaves.,0
856,huauhtli,/ˈwaːwt͡ɬi/,"amaranth, pigweed
1571, Alonso de Molina, Vocabulario en lengua castellana y mexicana y mexicana y castellana, f. 155r. col. 1.
Uautli. bledos.
(Uautli. amaranth.)",0
857,huehue,,Alternative spelling of huehueh,0
858,huehueh,[ˈwéː.weʔ],"elderly man, 1547, Andrés de Olmos, Arte para aprender",0
859,huehuehpil,[weːˈweʔ.piːɬ],"Diminutive of huēhueh; a small old man., 1555, Alonso",0
860,huehuehpol,[weːˈweʔ.poːɬ],"Augmentative of huēhueh; an old man, especially one",0
861,huehuenton,[weːˈwen.toː(n)],"Diminutive of huēhueh; a small old man., 1555, Alonso",0
862,huehuetcatontli,[weː.wet.kaːˈtoːn.t͡ɬi],"Diminutive of huēhueh; a small old man., 1555, Alonso",0
863,huehueyipol,[weː.weːˈji.poːɬ],"Something that is very large, bulky or stocky., 1571,",0
864,huehxolotl,[weʔˈʃoː.loːt͡ɬ],"turkey cock
1555, Alonso de Molina, Aqui comienca vn vocabulario en la lengua castellana y mexicana, f. 128v.
Gallo. uexolotl.",0
865,huelic,,"tasty, delicious.",0
866,huemmanaliztli,[wemːánaˈlíst͡ɬi],"(it is) the act of making of a sacrificial offering.,",0
867,huentli,[ˈwént͡ɬi],"(it is) a sacrificial offering
1571: Alonso de Molina, Vocabulario en lengua castellana y mexicana y mexicana y castellana, Pt 2, f. 156v. col. 2.
Ventli. ofrenda.
Ventli. an offering.
1571: Idem, Vocabulario en lengua castellana y mexicana y mexicana y castellana, Pt 1, f. 106v. col. 1.
Sacrificio o ofrenda. ventli. tlamanaliztli. vemmanaliztli. nextlaualli.
A sacrifice or offering. ventli. tlamanaliztli. vemmanaliztli. nextlaualli.",0
868,huentzintli,[wenˈt͡sin.t͡ɬi],"sacrificial offering, 1571, Alonso de Molina, Vocabulario",0
869,huetzi,,(intransitive) to fall,0
870,huetzi,,"1555, Alonso de Molina, Aqui comienca un vocabulario en la lengua castellana y mexicana, f. 39v.
Caer generalmente. ni,uetzi.",0
871,huexolotl,/weˈʃoː.loːt͡ɬ/,Alternative spelling of huehxolotl,0
872,huexotl,/weˈʃoːt͡ɬ/,willow,0
873,huexotlah,[weˈʃoː.t͡ɬaʔ],"A grove of willow trees., 1555, Alonso de Molina, Aqui",0
874,Huexotlah,,"Huejutla (the largest city in the modern state of Hidalgo, Mexico)",0
875,huey,,Alternative spelling of huēyi,0
876,hueyatl,[ˈweː.jaːt͡ɬ],"sea, ocean, 1555, Alonso de Molina, Aqui comienca vn",0
877,hueyi,[ˈweː.ji],"Something large, big, great, etc.
1555, Alonso de Molina, Aqui comienca vn vocabulario en la lengua castellana y mexicana, f. 132v.
Grande coſa.   uey .uey pul.yxachi.yxachipul.
Something big. uey. ueypul. yxachi. yxachipul.
1571, Idem, Vocabulario en lengua castellana y mexicana y mexicana y castellana, f. 66v. col. 1.
Grande coſa.vey.veypul.yxachi. yxachipul.
Something big. vey. veypul. yxaci. yxachipul.
Idem, f. 155v. col. 1.
Vey. grande.
Vey. big.",0
878,hueyicayotl,[weː.jiˈkaː.joːt͡ɬ],"greatness, 1571, Alonso de Molina, Vocabulario en lengua",0
879,huica,/ˈwiːka/,(transitive) to lead something or someone,0
880,huicci,/ˈwiksi/,(intransitive) To cook.,0
881,huilocalli,[wiː.loːˈká.lːi],"(it is) a dovecote; pigeon house., 1555, Alonso de",0
882,huiptla,/wiːptɬa/,The day after tomorrow.,0
883,huitequi,/wiːˈteki/,"(transitive) to strike something, to whip something",0
884,huitzitzilepyollohtli,[wi.t͡si.t͡si.lep.joːˈlːoʔ.t͡ɬi],"seed pearl, 1571, Alonso de Molina, Vocabulario en",0
885,huitzitzilin,,Hummingbird.,0
886,huitzitzilnahualeh,,"One who has a hummingbird disguise., 16C: Bernardino",0
887,huitzitzilnahualli,,Hummingbird disguise.,0
888,huitznahuac,,golden barrel cactus.,0
889,huitzquilitl,/witskilitɬ/,A kind of plant.,0
890,huitzquilli,,cardoon,0
891,huitzquiltzontecomatl,,artichoke,0
892,huitztli,/ˈwitstɬi/,"thorn, spine",0
893,huizacotl,,"A kind of rodent.
1555, Alonso de Molina, Aqui comienca un vocabulario en la lengua castellana y mexicana, f. 156v
Liron animal. xaltoçan.uiçacotl.chachauatl.",0
894,huēhuê,,Alternative spelling of huehueh,0
895,i,,(transitive) to drink,0
896,iautl,,Obsolete spelling of yāōtl,0
897,icah,/ˈikaʔ/,Sometime.,0
898,ichcacalli,[it͡ʃ.kaˈka.lːi],"sheep pen, sheepfold, 1555, Alonso de Molina, Aqui",0
899,ichcaconetl,[it͡ʃ.kaˈko.neːt͡ɬ],"lamb, 1555, Alonso de Molina, Aqui comienca vn vocabulario",0
900,ichcahuipilli,,gambeson.,0
901,ichcatilmahtli,[it͡ʃ.ka.tiɬˈmaʔ.t͡ɬi],"cotton cloak, 1555, Alonso de Molina, Aqui comienca",0
902,ichcueitl,,"A skirt of maguey fibre., 1547, Andrés de Olmos, Arte",0
903,ichpochtepiton,[it͡ʃpóːt͡ʃteˈpítoːn̥],"Diminutive of ichpōchtli; (she is) a young girl., 1571:",0
904,ichpochtli,[it͡ʃˈpóːt͡ʃ̚.t͡ɬi],"(she is) a maiden; a young, unwed woman., 1571, Alonso",0
905,ichpochtontli,[it͡ʃ.poːt͡ʃˈtoːn.t͡ɬi],"Diminutive of ichpōchtli; a girl, a young woman., 1571,",0
906,ichpochtotolin,[it͡ʃ.poːt͡ʃ.toːˈto.lin],"A young turkey hen; a turkey pullet., 1571, Alonso",0
907,ichtequi,/ˈit͡ʃteki/,"to steal, rob",0
908,ichtequiliztli,/it͡ʃteˈkilist͡ɬi/,"robbery, theft, 1571, Alonso de Molina, Vocabulario",0
909,ichtli,,Maguey fiber.,0
