L2_orth,L2_ipa,L2_gloss,L2_etym,en_ipa
paart,[paâɾt],"to plow a little, for a short time, paart rugaini līdz",,
pacept,[patsɛpt],"to roast, fry or bake something a little, for a short",,
paduse,[padusɛ],(anatomy) armpit (cavity beneath the junction of arm,,
pagātne,[paɡāːtnɛ],past (time period anterior to the present; circumstances,,
paklājs,[paklâːjs],"carpet, rug, mat (floor covering, usually soft, to",,
palodze,[palūōdzɛ],windowsill (a flat surface protruding from the base,,
palīdzēt,[palīːdzɛ̂ːt],"to help, to help out, to aid, to assist (to provide",,
pamats,[pamats],"base, basis, foundation",,
panna,[pānna],"pan (flat metal container, usually with a handle, used",,
paprika,[papɾika],"sweet pepper, bell pepper (non-spicy type or cultivar",,
paradokss,[paɾadoks],paradox (a contradiction between statements assumed,,
parast,[paɾast],(generally used only in its active participial form,,
pareizs,[paɾɛ̄īs],"precise, exact, correct, accurate (done without errors",,
parīt,[paɾîːt],"(in) the day after tomorrow, parīt ir sestdiena ― the",,
parītdiena,[paɾîːddìɛna],"the day after tomorrow, esmu brīvs līdz parītdienai",,
parīts,[paɾîːts],"the day after tomorrow; also, the future, labi būtu,",,
paslēpt,[paslɛ̀ːpt],to hide (to place something or someone in a place where,,
pastala,[pastala],"(usually in the plural) simple, primitive shoes made",,
pastmarka,[pastmaɾka],postage stamp (small piece of paper glued to envelopes,,
patulkot,[patūlkuôt],"to translate a little, to translate for a short time,",,
pavasaris,[pavasaɾis],"spring (season of the year between winter and summer,",,
pavēle,[pavɛ̄ːlɛ],"order, command (formal, binding oral or written instruction",,
pavēlēt,[pavɛ̄ːlɛ̂ːt],"to order, to command (to indicate, to tell what to",,
peldēt,[pɛ̄ldɛ̂ːt],"(of people, animals) to swim (to move in water by floating",,
pelnīt,[pɛ̀lnîːt],"to be paid, to earn (to receive payment for work, for",,
pelēks,[pælæ̂ːks],"gray (having the color of, e.g., ash; white with low",,
pergamentpapīrs,[pɛɾɡamɛntpapiːɾ],"parchment paper, wax paper (a special kind of paper",,
pergaments,[pɛɾɡamɛnts],parchment (material made from animal skin and used,,
peri,[pæɾi],"(chiefly in the plural) bee larvae, peru puve ― larvae",,
piecept,[piɛtsɛpt],"to roast, to bake, to fry something in large, or at",,
pieci,[pìɛtsi],"five (the cipher, the cardinal number five), pieci",*piek-,ˈæstɚɹˌɪsk pˈiːk
piedurkne,[pìɛdūɾknɛ],"sleeve (part of a garment that covers one's arms),",,
piemirst,[pìɛmìɾst],to forget temporarily; to be unable to remember (at,,
piemirst,[pìɛmìɾst],"3rd person singular present indicative form of piemirst,",,
piens,[pīɛ̄ns],"milk (nourishing liquid secreted by mammal females),",,
piere,[pìɛɾɛ],(anatomy) forehead (part of the human face between,*priere,ˈæstɚɹˌɪsk pɹˈaɪɚ
pierobeža,[pìɛɾuòbɛʒa],"borderland, border zone, frontier area (region close",,
pilns,[pīlns],"(of containers) full (without any space left), pilna",,
pilsonis,[pìlsuonis],"(male) citizen (a legal member of a state), Latvijas",,
pipars,[pipaɾs],pepper (plants of the families Piperaceae (genus Piper,,
pirkt,[pìɾkt],"to buy, to purchase (to obtain, to acquire something",,
plats,[plats],"wide, broad (having a relatively large distance from",,
plašs,[plaʃ],"wide, broad, spacious, large (occupying a large area),",,
polis,[pūōlis],"a Pole, a Polish man, a man born in Poland, pēc Livonijas",polak,pˈɑːlæk
post,[puôst],"tidy, clean, adorn",,
prast,[pɾast],"(often with an infinitive) to know how to, to be able",,
prasīt,[prasîːt],"to ask for, to request, to demand (to express the desire",,
priecīgs,[pɾiɛ̂ksîːɡs],"happy, glad, joyful, delighted (feeling joy), priecīgs",,
prieks,[pɾiɛ̂ks],"(only singular) joy, delight (intense positive emotional",*prie,ˈæstɚɹˌɪsk pɹˈaɪ
priesteriene,[pɾīɛ̄stɛɾiɛnɛ],priestess (female religious official trained to perform,,
prievārds,[pɾievàːɾds],(grammar) preposition (a word used to build a phrase,,
producēt,[pɾodutsɛ̂ːt],to produce (to make something come into existence by,,
profesore,[pɾofɛsoɾɛ],(female) professor (a woman who has the highest teaching,,
profesors,[pɾofɛsoɾs],(male) professor (a man who has the highest teaching,,
prāvs,[pràws],"large, big, sizeable, considerable (having size, dimensions",,
puisis,[pūīsis],"(unmarried) young man, youth, boy, puiša dienas ― young",,
pulkstenis,[pùlkstɛnis],"clock, watch (instrument to measure time), mehāniskais,",,
pulkstens,[pùlkstæns],"(dialectal) clock, watch; alternative form of pulkstenis",,
punšs,[punʃ],"punch (beverage), no rīsa dedzina, it kā no rudziem",punch,pˈʌnt͡ʃ
purvs,[pùɾvs],"swamp, bog, marsh, morass (low wetland with a layer",,
pusnakts,[pusnakts],"midnight (the middle of the night, when the sun is",,
pāksts,[pâːksts],"(botany) pod (a seed case for peas, beans, peppers,",,
pār,[pāːr],"(spatially) across, over, pār upi ― across the river,",,
pārcept,[paːɾtsɛpt],"to overcook (to roast, fry or bake something too much,",,
pārtulkot,[pāːɾtūlkuôt],"(perfective) to translate completely, entirely, pārtulkot",,
pātaga,[pàːtaɡa],"whip, lash, knout (tool, usually a flexible rod, often",,
pāvests,[pāːvɛsts],"Pope (the bishop of Rome, the head of the Catholic",,
pē,[pɛː],The Latvian name of the Latin script letter P/p.,,
pēc,[pɛː̂ts],"after, afterwards, later, later on (in a moment of",,
pēc,[pɛː̂ts],used to refer to a time posterior to a certain action,,
pēcpusdiena,[pɛː̂tspusdìɛna],afternoon (the time period after midday and before,,
pēkšņs,[pɛ̀ːkʃɲs],"sudden, abrupt (that which arrives, happens unexpectedly,",,
pērn,[pǣːɾn],"last year, tas notika pērn ― this happened last year,",,
pērns,[pǣːɾns],"(dated) of last year, last year's, pērnais rudens ―",,
pīle,[pīːlɛ],"duck (birds of family Anatidae), mājas pīle ― domestic",,
pļaujmašīna,[pʎāwmaʃīːna],"harvester, reaper, mower, header (a machine for harvesting,",,
pļava,[pʎava],"meadow (area of low vegetation, natural or sown, for",,
pļāpāt,[pʎāːpât],"to chat, to chatter, to babble, to gossip (to talk",,
pūt,[pūːt],to rot,,
pūt,[pūːt],"2nd person singular present indicative form of pūst,",,
pūķis,[pūːcis],"(mythology, religion) in old Latvian mythology, a household",,
R,[ɾ],"The twenty-fifth letter of the Latvian alphabet, called",,
rags,[ɾaks],"(anatomy) horn (solid growth on an animal's head),",,
raize,[raîzɛ],"concern, worry (negative emotional state caused by",,
raksts,[ɾaksts],"article, paper; a piece of writing, writing in general",,
raksturs,[ɾakstuɾs],"character, temperament, personality, nature (set of",,
rakstīt,[ɾakstîːt],"to write (to fix (a word, a sentence, a text by means",,
rakt,[ɾakt],"to dig, to spade, to shovel",,
rast,[ɾast],"to find (to cause by searching that something (desirable,",,
rats,[ɾats],"wheel (circular device that rotates on its axis), stūres",,
raudāt,[ɾaûdât],"to weep, to cry (to shed tears, often while breathing",,
raupjš,[ràwpʲʃ],"rough, harsh, uneven, rugged (having an irregular,",,
raža,[ɾaʒa],"harvest, yield (production obtained from plantations,",,
redzēt,[ɾɛdzɛ̂ːt],"to see (to perceive something visually), pa logu var",,
resns,[ræsns],(of cylindrical objects) thick (having a relatively,,
rets,[ɾæts],"thin, sparse (formed of a number of similar elements",,
riet,[riɛ̂t],"(of animals, especially dogs) to bark (to produce short,",,
rinda,[ɾīnda],"row, line, queue (ordered linear arrangement of objects",,
rits,[ɾits],(religion) rite (a religious custom or ceremony; the,,
roka,[ɾùoka],"(anatomy) hand, arm (each of the upper limbs of the",,
ronis,[ɾūōnis],"seal (several species of mammals of the family Phocidae),",,
roze,[rūōzɛ],"rose (decorative shrub, gen. Rosa, with beautiful flowers",,
runcis,[ɾūntsis],"male cat, tom cat, he-cat, kad runča nav mājās, tad",,
rupjš,[rupʲʃ],"(of mixtures, powder-like substances) coarse, rough",,
rātns,[ɾāːtns],"(of people, usually children) obedient, well-behaved",,
Rēzekne,[ɾɛ̄ːzɛknɛ],"Rēzekne (a city in Latvia), Rēzeknes vēsture ― the",,
Rīga,[ɾīːɡa],"Riga (the capital city of Latvia), Rīgas vēsturiskais",Rīga,ɹˈiːɡə
rīks,[ɾìks],"instrument, tool, equipment (an object used for a specific",,
rītdiena,[ɾîːddìɛna],"(the day of) tomorrow (the day after today), atlīkt",,
rīts,[ɾîːts],"morning (time of day, roughly around sunrise; also,",ritēt,ɹɪtˈɛt
s,[s],"The twenty-sixth letter of the Latvian alphabet, called",,
S,[s],"The twenty-sixth letter of the Latvian alphabet, called",,
saart,[saâɾt],(perfective; syn. uzart) to till (especially a larger,,
sacīt,[satsîːt],"to say, tell (to express something, especially something",,
saiklis,[sājklis],(grammar) conjunction (a word used to join words or,,
salds,[sâlts],"sweet (having the flavor typical of, e.g., sugar, or",,
salns,[sâlns],"(of animal, especially horse, hair) roan-colored (having",salna,sˈælnə
sarkans,[sâɾkans],"red (having the color of, e.g., blood), tumši, gaiši,",,
saukt,[sàwkt],"to call, to cry (intransitive: to shout, scream, yell),",,
saule,[sāūle],"sun (the star at the center of the Solar System, from",*saul-,ˈæstɚɹˌɪsk sˈɔːl
sauss,[sàws],"dry (containing (relatively) little or no liquid, moisture,",,
sauļot,[sāūʎuôt],"to expose (e.g., a body part) to sunrays and their",,
sedulka,[sædulka],(dialectal form) genitive singular   form of sedulks,,
sedulka,[sædulka],"harness saddle (part of a harness, placed on a horse's",,
segli,[sæɡli],"saddle (horse tack item, placed on the back of a horse",sedli,sˈɛdli
seglot,[sæɡluôt],"to saddle (to attach a saddle to an animal, usually",,
sekls,[sækls],"(of water, holes, etc.; also objects, containers) shallow",,
sekss,[sɛks],"sex, gender (the two groups in which most living beings",,
selga,[sǣlɡa],"a deep place, far from the coast (of a sea, big lake,",,
sermulis,[sæ̂ɾmulis],"stoat, ermine (a mustelid species of the weasel family,",,
seši,[sɛʃi],"six (the cipher, the cardinal number six), pieci un",,
siekalas,[sīɛ̄kalas],(usually in the plural) saliva (secretions of the glands,,
silts,[sīlts],"warm (with moderately high, generally pleasant temperature),",,
simbols,[simbɔls],"symbol (a sign or group of signs — image, ornament,",,
sirds,[sîɾts],(anatomy) heart (the central organ of the circulatory,sirdis,sˈɪədiz
sirms,[sīɾms],"(of hair, beard, etc) gray (having become grayish white",,
sirpis,[sìɾpis],sickle (hand tool with a semicircular blade used for,,
skaidrot,[skāīdruôt],"to explain (to make something clearer, more understandable,",,
skaidrs,[skāīdrs],"(of the weather, the sky) clean, clear, bright, without",,
skaists,[skāīsts],beautiful (having beauty; corresponding to certain,,
skaitīt,[skàjtîːt],"to count (to say the numbers in order), skaitīt līdz",,
skate,[skatɛ],"display, exhibition, show (a planned event with the",,
skatīt,[skatîːt],"to look at, to see (to perceive something visually,",,
skaut,/skaut/,to embrace,,
skaļrunis,[skaʎɾunis],loudspeaker (electromechanical device that converts,,
skaļš,[skaʎʃ],"(of sounds, sound sources) loud (relatively strong;",,
skumjas,[skùmjas],"sadness, grief (emotional state characterized by feelings",,
skumjas,[skùmjas],"genitive singular feminine  form of skumjš, nominative",,
skumjums,[skùmjums],"sadness (the quality or state of one who is sad), skatiena",,
skumjš,[skùmʲʃ],"sad (feeling sadness, grief; characterized by sadness,",,
skumt,[skùmt],"to be, become sad, to sadden, to feel sadness, sorrow,",,
skuķe,[skucɛ],"(colloquial) girl, young woman, Gundagas skopajās atmiņās",,
skuķis,[skucis],"(colloquial) girl, young woman, Brekšiem bija trīs",,
skābs,[skâːbs],"3rd person singular future indicative form of skābt,",,
skābs,[skâːbs],"sour (having a taste similar to, e.g., lemon), skābs",,
skūpsts,[skûːpsts],"kiss (a touch with the lips, used to express love,",,
skūpstīt,[skûːpstīːt],"to kiss (to touch with one's lips, in order to show",,
slaids,[slaîts],"(of people, body parts) lithe, slim, slender, augumā",,
slaiks,[slaîks],"(of people, body parts) tall, slender, slim, slaiks,",,
slapjš,[slapʲʃ],"wet (containing, having absorbed moisture, water or",,
slepkava,[slæpkava],"killer, murderer (a person who has committed murder,",,
slinks,[slīnks],"lazy (who is given to idleness, who typically does",,
sliņķis,[slīɲcis],"lazy man, animal, sliņķus suns ― lazy dog, tēvs necieš",,
sloka,[slùoka],"woodcock (several bird species of the genus Scolopax,",,
slota,[sluôta],"broom, besom (utensil for sweeping, traditionally made",,
slēpt,[slɛ̀ːpt],"to hide, to conceal (to put away (something, someone)",,
smags,[smaks],"heavy (such that it has great weight, a large mass),",,
smaids,[smāīts],"smile (facial expression, in which the ends of one's",,
smiekls,[smiɛ̂kls],"(usually plural) laugh, laughter (rhythmic, relatively",,
smuks,[smuks],"(colloquial) pretty, beautiful, handsome, smukas meitenes",,
smukums,[smukums],(colloquial) beauty (the state or quality of that which,,
sniegs,[snìɛks],"snow (frozen water that falls as precipitation), sniegs",,
sods,[sùots],"penalty, punishment",,
spalgs,[spâlks],"(of sounds) (very) loud, sharp, shrill, piercing, strident,",,
spalva,[spālva],"feather (branching, hair-like structure that covers",,
speķis,[spɛcis],"bacon, lard (subcutaneous fat layer on a pig; slice",,
spilgts,[spīlkts],"(of light, light sources) bright (very strong; which",,
spilve,[spìlve],cottongrass (various species of plants from the sedge,,
spilvens,[spìlvæns],"pillow, cushion (soft mass of material stuffed into",,
spirgts,[spīɾkts],"fresh, brisk, lively, sprightly, active, spirgts un",,
spodrs,[spuôdɾs],"shiny, lustrous, glossy, bright (such that its surface,",,
spogulis,[spūōɡulis],mirror (smooth surface that reflects light so as to,,
sportisks,[spoɾtisks],"athletic, sportive, sporty (relating to, characteristic",,
sportiskums,[spoɾtiskums],"sportiveness, athleticness (the state or quality of",,
spriedums,[spɾiɛ̂dums],"judgment, opinion (thought or idea expressed as an",,
spriest,[spɾiɛ̂st],"to judge (to make or formulate an opinion, a judgment),",,
spārns,[spàːɾns],"(anatomy, of birds, insects, bats) wing (one of a pair",*sparnas,ˈæstɚɹˌɪsk spˈɑː͡ɹnəz
spējš,[spɛ̀ːjʃ],"sudden, quick (which occurs, takes place quickly, unexpectedly,",,
spēks,[spæ̀ːks],(physics) force (physical quantity describing the interaction,,
spļaut,[spʎāwt],"(intransitive) to spit, to expectorate (to push, throw",,
staigns,[stàjɡns],"swampy, boggy, marshy, miry (such that it has humid,",,
stingrs,[stīŋɡɾs],"(of objects, materials, etc.) firm, strong, rigid (capable",,
stings,[stīŋɡs],"hard, firm, stiff, rigid (characterized by hardness,",,
stiprs,[stipɾs],"strong (person, animal with great strength, who is",,
stirna,[stīɾna],"roe deer (Capreolus capreolus), stirnu āzis, stirnuāzis,",*śírˀnāˀ,ˈæstɚɹˌɪsk ˈɛs ˈɑː͡ɹnˈɑː
stirnāzis,[stiɾnâːzis],"male roe deer (Capreolus capreolus), stirnāzis dzenā",,
straujš,[stɾàujʃ],"fast, quick, rapid (streaming, flowing rapidly), strauja",,
strauts,[strāūts],"creek, brook, small water stream, kalnu, meža strauts",,
strādāt,[stɾàːdâːt],to work (to perform certain actions so as to produce,,
studēt,[studɛ̂ːt],"to study at a university or college, studēt universitātē",,
stulbs,[stùlps],"stupid, dumb (mentally challenged, not able to comprehend,",,
stulms,[stûlms],"top of a boot, the part that covers the shin up to",,
stumt,[stùmt],"to push, to pull (to apply force to the front of something",,
stāds,[stàːts],"plant, plantlet, seedling (young, usually not large",*stādas,ˈæstɚɹˌɪsk stˈɑːdəz
stādīt,[stāːdîːt],"to plant (to place, to insert (plant, root, tubers,",,
stāsts,[stâːsts],"(literature) story (a literary work of art, in which",,
stāvoklis,[stāːvuoklis],"position, location (spacial configuration that exists",,
stāvēt,[stāːvɛ̂ːt],"to stand (to be in an upright position, supported by",*stā-,ˈæstɚɹˌɪsk stˈɑː
stīvs,[stīːws],"(of people, animals, their body parts) stiff, hard,",stīf,stˈɪf
svaine,[svâjnɛ],sister-in-law (one's wife's sister or one's husband's,,
svainis,[svâjnis],brother-in-law (one's wife's brother or one's husband's,,
svece,[svɛtsɛ],"candle (source of light), aizdegt sveci ― to light",,
sveiks,[svɛ̀jks],(often sveiks un vesels) safe; unharmed despite adverse,,
sviests,[sviɛ̂sts],"butter (a dairy product, obtained from cream, with",,
sviests,[sviɛ̂sts],"thrown, flung, slung; indefinite past passive participle",,
svārki,[svāːɾki],"(men's clothing) coat, jacket (upper part of a suit),",,
sākt,[sâːkt],"to begin, to start (to carry out the first steps, stages",,
sāls,[sàːls],salt (white crystalline substance — sodium chloride,*sal-,ˈæstɚɹˌɪsk sˈæl
sēklis,[sɛ̄ːklis],"shallow place, shallow, ford, sandbank, shoals (place",,
sērs,[sǣːrs],sulfur (nonmentallic chemical element with atomic number,,
sīks,[sîːks],"(objects, areas) tiny, little, small (having very small",,
sīks,[sîːks],"3rd person singular future indicative form of sīkt,",,
sīpols,[sīːpuols],"onion (herbaceous plant, sp. Allium cepa, with succulent",,
sūkt,[sùːkt],"to suck; to absorb, to pump (to cause liquids, gases,",,
t,[t],"The twenty-eighth letter of the Latvian alphabet, called",,
T,[t],"The twenty-eighth letter of the Latvian alphabet, called",,
tabaka,[tabaka],"tobacco (several plants of the genus Nicotiana, especially",,
tabakmaks,[tabakmaks],"tobacco pouch (small bag or pouch for keeping tobacco),",,
tagad,[taɡat],"now (at the present moment), atnāciet rīt, tagad man",,
tas,[tas],"(used as a determiner) that, kur ir tas zirgs? ― where",,
taurs,[tàurs],"aurochs (Bos primigenitus, the extinct ancestor of",,
taustīt,[tâwstîːt],"to feel, to touch, to palpate (to use the sense of",,
tauta,[tàwta],"people, nation (historically formed group of people,",*tawtā-,ˈæstɚɹˌɪsk tˈɔːɾə
taču,[tatʃu],"but, but also; adversative conjunction, used to express",,
taču,[tatʃu],particle used to reinforce or emphasize a certain word,,
teikt,[tɛ̀ikt],"to say, to tell (to express something, especially something",,
telts,[tēlts],tent,,
ticēt,[titsɛ̂ːt],to believe (to have a belief in something; to accept,,
tievs,[tiêws],(of cylindrical objects) thin (having a relatively,*tenˀwas,ˈæstɚɹˌɪsk tˈɛnwəz
tilts,[tīlts],bridge (a structure built to go over an area that is,,
tinte,[tīnte],"ink (a colored liquid used for writing), zilā, sarkanā,",,
tirgus,[tìɾɡus],"market, marketplace (a square, a building, a space,",,
traks,[tɾaks],"(of animals) mad, rabid (affected with rabies), traks",,
traucēt,[tràwtsɛ̂ːt],"to disturb, to inconvenience, to bother, to interfere",,
trīs,[trîːs],"three (the cipher, the cardinal number three), viens,",,
trūkt,[tɾūːkt],"to lack, to be in short supply, to not be available,",,
tuksnesis,[tuksnɛsis],"desert (large barren area, with little or no vegetation,",,
tulkot,[tūlkuôt],"to translate (to change, transfer text, sentences,",,
tulks,[tūlks],"translator, interpreter (a person who translates texts,",,
tumšs,[tùmʃ],"dark (where, when there is insufficient, little or",,
turpinājums,[tùɾpinâːjums],continuation (the act of continuing something; that,,
turpināt,[tùɾpinâːt],2nd person plural present indicative form of turpināt,,
turpināt,[tùɾpinâːt],"to continue, to go on doing (something), to not interrupt",,
turpmāks,[tūɾpmâːk],"next, further, coming, following, subsequent, future,",,
turēt,[tuɾɛ̂ːt],"to hold (to keep something that was taken, grabbed,",,
tuvs,[tuws],"close, near, nearby (located, living, coming from,",,
tāfele,[tāːfɛlɛ],"blackboard, chalkboard, whiteboard (rectangular surface",,
tāls,[tâːls],"far, far away, distant (situated, living, coming from,",,
tāss,[tāːss],"birchbark (white bark of the birch tree, formerly used",,
tē,[tɛː],The Latvian name of the Latin script letter T/t.,,
tētis,[tɛ̄ːtis],"father, dad (with more emotional attachment), mamma",,
tēvocis,[ˈtǣːvuôt͡sis],"uncle (father's or mother's brother), mazais zēns kopā",,
tēvs,[tǣːws],"father (a man who has a child or children), tēvs ar",,
tīrs,[tīːɾs],"(of objects) clean (which is not dirty, has no stains,",,
u,[u],"The twenty-ninth letter of the Latvian alphabet, called",,
u,[u],The name of the Latin script letter U/u.,,
U,[u],"The twenty-ninth letter of the Latvian alphabet, called",,
un,[ùn],additive conjunction used to link similar terms in,,
upuris,[upuɾis],"(religion, mythology) offering, sacrifice (object or",,
uzart,[saâɾt],"(perfective) to till by plowing, uzart papuvi ― to",,
uzdevums,[uzdɛvums],"(assigned) task, duty (that which someone is supposed",,
uzsvars,[usvaɾs],"emphasis, stress (the highlighting of, e.g., a thought,",,
v,[v],"The thirty-first letter of the Latvian alphabet, called",,
vads,[vats],"pipe, tube, duct, chute (a cylindrical structure for",,
vaina,[vāīna],"fault, guilt (an offense punishable according to the",,
vaisla,[vàjsla],"breed, breeding (the continuation of the species via",,
vakar,[vakar],"yesterday (in the day before today), vakar bija slikts",,
vakardiena,[vakaɾdìɛna],"(the day of) yesterday, the day before today, vakardienas",,
vakariņas,[vakaɾiɲas],"dinner (the evening meal, usually not the largest meal",,
vakars,[vakaɾs],"evening (time of day, roughly around sunset; also,",,
valgs,[vālks],"humid, moist, damp, wet (having absorbed or containing",,
valis,[valis],"whale (large maritime mammals of the order Cetacea),",,
Valmiera,[vàlmīɛ̄ɾa],"Valmiera (the largest city in the Vidzeme region, in",,
valoda,[valuôda],language,,
valsts,[vàlsts],"state, country (a sovereign polity with a government;",,
valūta,[valùːta],"currency (a specific, usually foreign, country's official",,
varavīksne,[vaɾavîːksnɛ],"rainbow (multicolored arch in the sky), varavīksne",,
varde,[vârde],"frog (small, tailless amphibian (order: Anura) which",,
varēt,[vaɾɛ̂ːt],can; to be able to (to have the mental or physical,,
vasara,[vasaɾa],"summer (season of the year, from June 21-22 to September",,
vasks,[vasks],"wax (an oily, water-resistant substance), grīdas vasks",*waksa,ˈæstɚɹˌɪsk wˈæksə
vecs,[væts],"(of people, living beings) old (who has lived relatively",,
vedekla,[vædækla],"daughter-in-law (one's son's wife), otrdien, kad viņa",,
veids,[vɛ̄īts],"form (one of various types of existence), matērija",,
veikals,[vēīkals],"shop, store (a commercial enterprise; its specific",,
veikls,[vēīkls],"(of people, animals, their bodies) agile, dexterous,",,
verbs,[vɛɾbs],"(grammar) verb (a word that indicates an action, event",,
vesels,[væsæls],"healthy (not sick, not wounded; being in good health),",,
Vidzeme,[ˈvid.zeme],Vidzeme (a historical region in northeastern Latvia,,
viegls,[vìɛɡls],"light, lightweight (which is not heavy, has low weight,",,
vienot,[viɛ̂nuôt],"to link, to connect, vienot kopā vadu galus ― to connect",,
viens,[viɛ̂ns],"one (the cipher, the cardinal number one), pieci un",*eynos,ˈæstɚɹˌɪsk ˈaɪnoʊz
viesis,[vìesis],"(male) visitor, guest (a person who comes to visit",,
viesnīca,[vìesnīːtsa],hotel (establishment that provides accommodation for,,
Vikipēdija,/ˈvikipɜdija/,Wikipedia,Wikipēdija,wˈɪkipˌɛdɪd͡ʒə
vilciens,[vìlciens],"one-off event of dragging, pulling, drawing, or its",,
vilks,[vìlks],"wolf (esp. Canis lupus), pelēkais vilks ― gray wolf,",,
vilks,[vìlks],"3rd person singular future indicative form of vilkt,",,
vilnis,[vîlnis],"wave (elevation of water surface due to a disturbance),",,
vingrs,[vīŋɡɾs],"(of people, their bodies) firm, strong, fit, agile,",,
virs,[vìrs],"on, over, above (with or without motion), mati virs",,
virsis,[vìrsis],"(usually in the plural) heather (an evergreen plant,",,
virsus,[vìrsus],"(rare, usually virsa) top, surface, zemes virsū ― on",,
viss,[vis],"(usually singular) all, whole, entire (considered as",,
viss,[vis],"(masculine singular forms) all, everything, anything,",,
viņš,[viɲʃ],"he; third person pronoun, referring to someone other",,
vāci,[vāːtsi],"(rare, only plural) Germans (people from Germany; members",,
vājš,[vâːjʃ],"(of people, animals) weak (not having well developed",,
vāks,[vâːks],"lid, movable cover (to protect something), lādes, šķirsta,",,
vālodze,[vāːluôdzɛ],"oriole (various colorful birds of the family Oriolidae,",wołać,wˈɑːlæk
vārdnīca,[ˈvɑːrdniːtsɑ],dictionary,,
vārds,[vàːɾds],"name, word",*wardas,ˈæstɚɹˌɪsk wˈɔː͡ɹdəz
vārna,[vāːɾna],"crow (several species of passerine birds of genus Corvus,",,
vārīt,[vàːɾîːt],"to boil (to heat something up to ebullition temperature),",,
vāvere,[vaːvɛɾɛ],"squirrel (family Sciuridae), rudā vāvere ― red squirrel,",,
vāverēns,[vāːvɛɾɛ̄ːns],baby squirrel,,
vē,[vɛː],The Latvian name of the Latin script letter V/v.,,
vēdeklis,[vɛ̄ːdɛklis],hand fan (hand-held device that can be waved back and,,
vēdzele,[vɛ̂ːdzɛlɛ],"burbot (two fish species), saldūdens vēdzele ― freshwater",,
vējš,[vɛ̄ːjʃ],"wind (air in motion due to uneven atmospheric pressure),",,
vēl,[vɛ̂l],(in negative sentences) used to indicate that a given,,
vēl,[vɛ̂l],used to emphasize or reinforce the meaning of an expression;,,
vēl,[vɛ̂l],"3rd person singular present indicative form of vēlēt,",,
vēls,[væ̂ls],"late (approaching the end of a certain time period),",,
