L2_orth,L2_ipa,L2_gloss,L2_etym,en_ipa
vērsis,[vɛ̀ːrsis],"ox (male cattle, usually castrated, often used as a",,
Vērsis,[vɛ̀ːrsis],(astronomy) the constellation of Taurus; astronomical,,
vēsma,[vǣːsma],"breeze (slow, gentle wind), silta pavasara vēsma ―",,
vēss,[vǣːs],"cool, cold (having a moderately low temperature), vēss",,
vēstule,[væ̀ːstulɛ],"letter (a written message for someone, especially if",,
vēsture,[væ̀ːstuɾɛ],"history (a chain of events, a process seen as evolving",,
vēsturniece,[væ̀ːstuɾniɛtsɛ],"(female) historian (a specialist in history), slavena",,
vētra,[vǣːtɾa],storm (very strong wind (up to 30 m/s) which causes,*wētrā,ˈæstɚɹˌɪsk wˈɛtɹə
vēzis,[vɛ̂ːzis],"(crustacean) crayfish, jūras vēži ― sea crayfish, upes",,
Vēzis,[vɛ̂ːzis],(astronomy) the constellation of Cancer; astronomical,,
vīns,[vīːns],"wine (alcoholic drink made from berriess or fruit juices),",wīn,wˈɪn
vīrietis,[vīːɾietis],"man (a human being of the male sex)., jauns, vecs vīrietis",,
vīrs,[vīːɾs],"husband (a married man, in reference to his wife),",,
Wikipēdija,/ˈvikipeːdija/,Wikipedia,enciklopēdija,ɛnsˈɪkloʊpdˌɪd͡ʒə
z,[z],"The thirty-second letter of the Latvian alphabet, called",,
Z,[z],"The thirty-second letter of the Latvian alphabet, called",,
zagle,[zaɡlɛ],"(female) thief (a woman who carries out thefts), nekas",,
zaglis,[zaɡlis],"(male) thief (a man who carries out thefts), kabatas",,
zaldāts,[zāldāːts],(dated) soldier (especially in the czar's or in the,,
zarna,[zâɾna],"(anatomy, often plural) intestine, bowel (part of the",,
zaudēt,[zàwdɛ̂ːt],to lose (to cause something to not be in one's possession,,
zaķis,[zacis],"hare (esp. Lepus europaeus), pelēkais, baltais zaķis",,
zaļš,[zaʎʃ],"green (having the color typical of, e.g., grass and",,
zebra,/ˈzɛbra/,zebra (esp. Equus zebra),,
zelts,[zæ̀lts],"gold (metallic chemical element, with atomic number",*želtas,ˈæstɚɹˌɪsk ˈɛltəz
zeme,[zɛmɛ],"ground, land, mainland (geographical, ethnic), earth,",,
Zeme,[zɛmɛ],"(astronomy, geography) Earth (third planet in the Solar",,
zems,[zæms],"low, short (having relatively little distance from",,
zeņķis,[zɛ̄ɲcis],"(colloquial) boy (male child, especially of school",,
ziema,[zìɛma],"winter (season of the year between autumn and spring,",,
ziemot,[zìɛmuôt],"to winter, to overwinter (to stay, to continue living",,
ziepes,[ziɛ̃pɛs],"soap (substance, synthetic or derived from fats, used",,
zilonis,[ziluònis],"elephant (fam. Elephantidae), ziloņu mātīte ― female",,
zinātne,[zinâːtnɛ],(chiefly in the singular) science (system of practices,,
zirdziņš,/ˈzir.d͡ziɲʃ/,"(colloquial, usually childish) gee-gee, horsey, horse,",,
zirgs,[zîɾks],"horse (esp. Equus caballus; generic word), šķirnes",,
zirnis,[zīɾnis],"pea (several plants of the family Fabaceae, especially",,
zivs,[ziws],"fish (animal that lives in water, moving with fins",,
ziņote,[ziɲuôtɛ],(obsolete term) science,,
znots,[znuōts],"son-in-law (one's daughter's husband), māte ar sirdi",,
zobens,[zùobɛns],"(weaponry) sword (long-bladed weapon with a handle,",,
zobs,[zùops],"(anatomy) tooth (a hard, calcareous element in a structure",*źámbas,ˈæstɚɹˌɪsk zˈiː ˈɛmbˈæs
zupa,[zupa],"soup (boiled liquid food, usually containing meat,",,
zvaigzne,[zvàjɡznɛ],(astronomy) star (celestial body mostly composed of,,
zvejot,[zvejuôt],to fish (to catch fish or other maritime animals (or,,
zviegt,[zvìɛkt],"(only 3rd person, of horses) to neigh, to whinny (to",,
zvirbulis,[zvīɾbulis],"sparrow (a number of bird species of the order Passeriformes,",,
zvērs,[zvæ̂ːɾs],"beast, (wild) animal (usually a mammal), kažokādu zvēri",,
zvīņa,[zvīːɲa],(dialectal form) genitive singular   form of zvīnis,,
zvīņa,[zvīːɲa],(chiefly in the plural) scales (little bone-like plates,,
zābaks,[zàːbaks],"boot (footwear with short or long tops), viriešu, sieviešu",,
zāģis,[zāːɟis],"saw (a tool with a sharp, usually toothed, blade, used",,
zāģēt,[zāːɟɛ̂ːt],to saw (to cut something with a saw; to work with a,,
zē,[zɛː],The Latvian name of the Latin script letter Z/z.,,
zēns,[zǣːns],"boy (a male child, approximately until 11 years of",,
zīlīte,[zīːlìːtɛ],"diminutive of zīle, (anatomy) pupil (opening in the",,
zīmulis,[zìːmulis],"pencil (instrument made of graphite or lead, usually",,
zīst,[zîst],"to suck, to suckle (to press a female nipple with one's",,
zīst,[zîst],"3rd person singular present indicative form of zīt,",,
ā,[aː],"The second letter of the Latvian alphabet, called garais",,
Ā,[aː],"The second letter of the Latvian alphabet, called garais",,
ābele,[âːbɛle],"apple tree (gen. Malus), stādīt, kopt ābeles ― to plant,",,
ābols,[âːbuols],"apple fruit, salds, skābs, sulīgs ābols ― sweet, sour,",*āˀbōl,ˈæstɚɹˌɪsk ɐbˈɑːl
āda,[âːda],(anatomy) skin (external cover of the (human or animal),,
ālants,[āːlants],"ide (small fish species of the family Cyprinidae, species",,
āmurs,[āːmuɾs],"hammer (tool with heavy head for pounding), koka āmurs",hamarr,hˈæmɑː͡ɹ
āpsis,[âːpsis],"badger (name of several species of mustelids, especially",,
ārsts,[āːrsts],"(male) doctor, physician (a specialist with a medical",,
ātrs,[āːtɾs],"fast, quick, rapid (capable of moving long distances",,
āzis,[âːzis],"male goat, billy goat, buck, āža bārda, bārdiņa ― (little)",,
č,[tʃ],"The fifth letter of the Latvian alphabet, called čē",,
četri,[tʃɛtri],"four (the cipher, the cardinal number four; sometimes",,
čiekurs,[tʃiēkurs],"(botany) conifer cone (the fruit, or reproductive organ, of a conifer tree)
ciedra čiekurs ― cedar cone
priežu, egļu čiekuri ― pine, spruce cones
zaļš čiekurs ― green cone
lasīt čiekurus ― to pick, gather cones",,
čoms,[tʃoms],"(colloquial) a male friend, a buddy, a pal, tiklīdz",chum,t͡ʃˈʌm
čē,[tʃɛː],The Latvian name of the Latin script letter Č/č.,,
čība,[tʃīːba],"(usually in the plural) slipper (low, soft shoe easily",,
čūska,[tʃūska],snake (many species of legless reptiles of the suborder,,
ē,[ɛː],"The eighth letter of the Latvian alphabet, called garais",,
Ē,[ɛː],"The eighth letter of the Latvian alphabet, called garais",,
ēna,[ǣːna],"shadow (dark image produced by blocking light), melna",,
ērce,[ɛ̄ːɾtsɛ],"tick, mite (numerous species of tiny arachnids of subclass",,
ērglis,[ɛ̀ːrɡlis],"eagle (large carnivorous birds in fam. Accipitridae,",*er-el-,ˈæstɚɹˌɪsk ɪɹˈɛl
ērts,[æ̀ːɾts],"comfortable, convenient (which can be carried out easily,",,
ēst,[ɛ̂ːst],to eat (to take food into one's mouth in order to chew,*ēˀstei,ˈæstɚɹˌɪsk ˈɛsteɪ
ēzelis,[ɛ̄ːzɛlis],"donkey (esp. Equus asinus)
jāt, braukt ar ēzeli ― to ride a donkey
nastu nesējs ēzelis ― burden-carrying donkey
dumjš, stulbs kā ēzelis ― silly, stupid as a donkey
spītīgs kā ēzelis ― stubborn as a donkey",,
Ģ,[ɟ],"The eleventh letter of the Latvian alphabet, called",,
ģerbonis,[ɟæ̀rbùonis],"coat of arms, armorial bearings",,
ģimene,[ɟimɛnɛ],family (group formed by a couple and their children,,
ģints,[ɟìnts],"(historical, anthropology) family, kin group, clan",,
ģē,[ɟɛː],The Latvian name of the Latin script letter Ģ/ģ.,,
ī,[iː],"The fourteenth letter of the Latvian alphabet, called",,
Ī,[iː],"The fourteenth letter of the Latvian alphabet, called",,
īgns,[îɡns],"morose, gloomy, sullen, surly, somewhat angry (who",,
īgt,[îːkt],"to be surly, sullen, angry, viņš īga, dziļi, sāpīgi",*ing-,ˈæstɚɹˌɪsk ˈɪŋ
īlens,[īːlæns],"awl (pointed instrument for piercing small holes),",,
īpašība,[īːpaʃìːba],"essential, typical feature, trait, characteristic,",,
īss,[îːs],"short (having relatively little length, less than average",,
īstens,[īːstɛns],"real, true, genuine, mājas īstenais saimnieks ― the",,
īsts,[īːsts],"real, true, genuine, not false or artificial, īsts",,
īstums,[īːstums],"realness, trueness, genuineness, authenticity (the",,
Ķ,[c],"The seventeenth letter of the Latvian alphabet, called",,
ķ,[c],"The seventeenth letter of the Latvian alphabet, called",,
ķauķis,[caucis],warbler,,
ķemme,[cɛ̄mmɛ],"comb (a toothed implement used for grooming one's hair),",,
ķermenis,[cɛ̄ɾmɛnis],"(physics) body (physical object, material entity),",,
ķerra,[cærːa],"wheelbarrow (small, one-wheeled cart with handles),",,
ķieģelis,/cieɟelis/,brick,,
ķiploks,[cipluōks],"garlic (herbaceous plant, sp. Allium sativum, with",klüflōk,kˌeɪˈɛl flˈɑːk
ķirbis,[cīrbis],"pumpkin, squash, gourd (plants; fam. Cucurbitaceae),",,
ķirzaka,[cīrzaka],"lizard (any reptile of the order Squamata)
ķirzakas iznīcina kaitīgus kukaiņus ― lizards destroy harmful insects
atšķirībā no zivīm ķirzakas galvu ar vidukli savieno kakls ― unlike fish, lizards have a neck connecting the head to the waist",,
ķē,[cɛː],The Latvian name of the Latin script letter Ķ/ķ.,,
ķēde,[cɛ̄ːdɛ],"chain (sequence of interconnected, usually metal, rings",,
ķēniņš,[cɛ̄ːniɲʃ],"(dated) king (the monarch of a kingdom), kungs un kēniņš",könink,kˈeɪ nˈɪŋk
ķēve,[cɛ̄ːvɛ],"female horse, mare, filly, ķēves piens ― horse (lit.",,
ķīmiķis,/ˈciːmicis/,"(male) chemist (a specialist in chemistry)
no oglēm ķīmiķi iegūst vilnas šķiedru ― from coal chemists obtain wool fiber",,
ķīsis,[cīːsis],"ruffe (small freshwater fish, especially Gymnocephalus",,
Ļ,[ʎ],"The nineteenth letter of the Latvian alphabet, called",,
ļ,[ʎ],"The nineteenth letter of the Latvian alphabet, called",,
ļaudis,[ʎàwdis],"people (a number of human individuals), gudri ļaudis",,
ļauns,[ʎāūns],"evil, wicked (whose behavior, attitude towards others",,
ļoti,[ʎùoti],(with an adjective or adverb) used to intensify the,,
Ņ,[ɲ],"The twenty-second letter of the Latvian alphabet, called",,
ņ,[ɲ],"The twenty-second letter of the Latvian alphabet, called",,
ņemt,[ɲɛ̂mt],"to take (to seize with one's hands for some purpose),",,
ņiprs,[ɲipɾs],"nimble, brisk, agile; healthy, physically well developed;",,
Š,[ʃ],"The twenty-seventh letter of the Latvian alphabet,",,
š,[ʃ],"The twenty-seventh letter of the Latvian alphabet,",,
šaurs,[ʃàuɾs],narrow (having little breadth; having a relatively,,
šausmas,[ʃāūsmas],"terror, horror (very intense fear), šausmu pārņemts",,
šašliks,[ʃaʃliks],shashlik (a type of skewered food cooked on an open,,
šeit,[ʃɛît],"here (the speaker's location at the time of speaking),",*sey-,ˈæstɚɹˌɪsk sˈeɪ
šis,[ʃis],"(used as a determiner) this, šis ūdens ir netīrs ―",,
šmaukt,[ʃmàwkt],"(colloquial) to go quickly, to run, suns pienāk pie",,
švaks,[ʃvaks̪],"(colloquial) weak, poor, švaka veselība ― poor health,",,
šķidrs,[ʃcidɾs],(physics) liquid (in a state of matter such that it,,
šķirklis,[ʃcīɾklis],"entry (an article in a dictionary, where a given word",,
šķēps,[ʃcæ̀ps],"spear, lance (a weapon with a sharp point for cutting]]),",,
šķēres,[ʃcɛ̄ːɾɛs],"scissors (tool for cutting, consisting of two interconnected",,
šķērslis,[ʃcɛ̀ːɾslis],"obstacle, barrier (an object that makes movement along",,
šķērsot,[ʃcɛ̀ːɾsuôt],"to cross (to be positioned transversally, across something),",,
šķērss,[ʃcɛ̀ːɾs],"transverse, transversal, crosswise (placed in such",,
šķērst,[ʃcɛ̀ːɾst],to cut a dead animal or human so as to expose the internal,,
šķīsts,[ʃcîːsts],"(religion) pure, immaculate, without sin (who never",,
šķīvis,[ʃcīːvis],"dish, plate (round, rarely oval, usually flat bowl",,
šūt,[ʃūːt],to sew (to join pieces of fabric together by passing,,
ū,[uː],"The thirtieth letter of the Latvian alphabet, called",,
Ū,[uː],"The thirtieth letter of the Latvian alphabet, called",,
ūdens,[ûːdɛns],water (transparent liquid substance formed by hydrogen,*ūden-,ˈæstɚɹˌɪsk jˈuːdən
ūdrs,[ûːdrs],"otter (any aquatic or marine mustelid), parastais ūdrs",,
ūsa,[ūːsa],(chiefly in the plural) moustache (hair between the,,
ž,[ʒ],"The thirty-third letter of the Latvian alphabet, called",,
Ž,[ʒ],"The thirty-third letter of the Latvian alphabet, called",,
žigls,[ʒiɡls],"fast, quick, swift, agile (capable of traveling long",,
žirgts,[ʒīɾkts],"lively, vivacious, brisk, sprightly, healthy, active,",,
žogs,[ʒùoɡs],fence (a barrier or enclosure surrounding and protecting,,
žoklis,[ʒuôklis],(anatomy) jaw (facial bone which supports the teeth;,,
žurka,[ʒùrka],(dialectal form) genitive singular   form of žurks,,
žurka,[ʒùrka],"rat (esp. genus Rattus), žurku slazds ― a rat (= mouse)",,
žē,[ʒɛː],The Latvian name of the Latin script letter Ž/ž.,,
