L2_orth,L2_ipa,L2_gloss,L2_etym
स्वर्,ˈæstɚɹˌɪsk ˈɛs hˈɑː͡ɹ,"Alternative spelling of सुर् (sur), to make music",*súHar
स्वसृ,ˈæstɚɹˌɪsk ˌɛsdˈʌbəljˌuː sˈɑː,"a sister, c. 1700 BCE – 1200 BCE, Ṛgveda 7.71.1:अप",*swásā
स्वादु,ˈæstɚɹˌɪsk ˌɛsdˈʌbəljˌuː ˌeɪt͡ʃdˌiːjˈuː,"delicious, tasty, savoury, palatable, sweet, delicate,",*swáHduš
स्वादु,ˈæstɚɹˌɪsk ˌɛsdˈʌbəljˌuː ˌeɪt͡ʃdˌiːjˈuː,"sweetness, pleasantness, charm, beauty, sugar, molasses,",*swáHduš
स्वादु,ˈæstɚɹˌɪsk ˌɛsdˈʌbəljˌuː ˌeɪt͡ʃdˌiːjˈuː,"grape, Synonyms: see Thesaurus:द्राक्षा",*swáHduš
स्विद्यति,ˈæstɚɹˌɪsk ˌɛsdˈʌbəljˌuː dˈaɪɾi,"to sweat, perspire",*swíd-ye-ti
स्वेद,ˈæstɚɹˌɪsk ˌɛsdˈʌbəljˌuː ˈɪdəz,"sweat, perspiration, c. 1700 BCE – 1200 BCE, Ṛgveda",*swáydas
स्वेद,ˈæstɚɹˌɪsk ˌɛsdˈʌbəljˌuː ˈɪdəz,"sweating, perspiring, toiling",*swáydas
स्वेदते,ˈæstɚɹˌɪsk ˌɛsdˈʌbəljˌuː ˈɪdeɪɾəi,"to sweat, perspire, to be anointed, to be disturbed",*swáydatay
हंस,ˈæstɚɹˌɪsk ˈænz,"a goose, gander, swan, flamingo (or other aquatic bird,",*ȷ́ʰansás
हंस,ˈæstɚɹˌɪsk ˈænz,"name of a Deva-gandharva, name of a Dānava, name of",*ȷ́ʰansás
हन्ति,ˈæstɚɹˌɪsk zˈiː ˌɛntˌiːˈaɪ,"to strike, beat (also a drum), pound, hammer (+ accusative)",*źʰánti
हिरण्य,ˈæstɚɹˌɪsk ˈɑː͡ɹhˈænɪˌæm,"gold, c. 1700 BCE – 1200 BCE, Ṛgveda 7.90.6:ई॒शा॒नासो॒",*ȷ́ʰr̥Hanyam
हुत,ˈæstɚɹˌɪsk ˈʌt,"poured out, offered in fire, libated, c. 700 BCE, Śatapatha",*ǵʰutós
हुत,ˈæstɚɹˌɪsk ˈʌt,"oblation, offering (that which is poured)",*ǵʰutós
हृदय,ˈæstɚɹˌɪsk zˈiːrdˈeɪæm,"the heart, RV 6.53.8c, यां पूषन्ब्रह्मचोदनीमारां बिभर्ष्याघृणे।तया",*źʰŕ̥dayam
हृदय,ˈæstɚɹˌɪsk zˈiːrdˈeɪæm,"going to the heart, (by extension) inward",*źʰŕ̥dayam
हृद्,ˈæstɚɹˌɪsk zˈiːɚd,"heart, Synonym: हृदय (hṛ́daya), soul, mind, the heart",*źʰŕ̥d
हेड,ˈæstɚɹˌɪsk zˈiː wˈaɪˈæz,"anger, passion, hatred, Synonyms: क्रोध (kródha), रोष",*źʰáyẓḍas
हेति,ˈæstɚɹˌɪsk ˈaɪt,"a missile, c. 1700 BCE – 1200 BCE, Ṛgveda 2.3.14:परि॑",*ǵʰeyt-
हेळ,ˈæstɚɹˌɪsk wˈaɪ dˈæs,"(Vedic) anger, passion, hatred, Synonyms: क्रोध (kródha),",*ȷ́ʰáyždas
हेषस्,ˈæstɚɹˌɪsk zˈiː jˈæz,"missile, quickness, valour",*źʰáyṣas
ह्यस्,ˈæstɚɹˌɪsk wˈaɪ,"yesterday, c. 1700 BCE – 1200 BCE, Ṛgveda 8.99.1:त्वामिदा",*ȷ́ʰyás
ह्रादते,ˈæstɚɹˌɪsk zˈiːɚɹ ˈeɪt͡ʃdˈeɪɾəi,"to sound, to make a noise, to roar",*źʰráHdatay
